date,time,title,tournament,game-id,home-team,away-team,pre-match_odds_home,pre-match_odds_draw,pre-match_odds_away
14-09-25,10:30,Calcutta Customs vs United Sports Club,India Calcutta Premier Div.,27667,Calcutta Customs,United Sports Club,2.65,3.2,2.45
14-09-25,08:00,Excelsior Rotterdam Srl vs Sparta Rotterdam SRL,Simulated Reality League Eredivisie SRL,26971,Excelsior Rotterdam Srl,Sparta Rotterdam SRL,3.14,3.65,2.19
14-09-25,08:00,Heracles SRL vs AZ Alkmaar SRL,Simulated Reality League Eredivisie SRL,27468,Heracles SRL,AZ Alkmaar SRL,5.86,4.53,1.52
14-09-25,08:00,SC Telstar Srl vs Fortuna Sittard SRL,Simulated Reality League Eredivisie SRL,27653,SC Telstar Srl,Fortuna Sittard SRL,2.42,3.5,2.85
14-09-25,08:00,Utrecht SRL vs Groningen SRL,Simulated Reality League Eredivisie SRL,27342,Utrecht SRL,Groningen SRL,1.77,3.94,4.31
14-09-25,09:00,Chuncheon FC vs Paju Citizen FC,Republic of Korea K3 League,13031,Chuncheon FC,Paju Citizen FC,2.6,2.95,2.7
14-09-25,11:00,Ulsan Citizen FC vs Busan Transportation Corporation FC,Republic of Korea K3 League,22375,Ulsan Citizen FC,Busan Transportation Corporation FC,2.85,3.25,2.3
14-09-25,12:00,Kalmar FF vs Vasteras SK,Sweden Superettan,34241,Kalmar FF,Vasteras SK,2.15,3.4,3.33
14-09-25,14:00,Trelleborgs FF vs Sandvikens IF,Sweden Superettan,34402,Trelleborgs FF,Sandvikens IF,2.25,3.5,3.0
14-09-25,08:00,Fenerbahce SRL vs Trabzonspor SRL,Simulated Reality League Turkey Super Lig SRL,28515,Fenerbahce SRL,Trabzonspor SRL,1.43,4.82,6.93
14-09-25,08:00,Gaziantep SRL vs Kocaelispor Srl,Simulated Reality League Turkey Super Lig SRL,28095,Gaziantep SRL,Kocaelispor Srl,2.08,3.39,3.64
14-09-25,08:00,Kayserispor SRL vs Goztepe SRL,Simulated Reality League Turkey Super Lig SRL,40145,Kayserispor SRL,Goztepe SRL,3.46,3.28,2.19
14-09-25,12:00,Naestved BK vs Thisted FC,Denmark 2nd Division,15071,Naestved BK,Thisted FC,1.99,3.4,3.3
14-09-25,12:00,Vendsyssel FF vs FC Helsingoer,Denmark 2nd Division,42006,Vendsyssel FF,FC Helsingoer,1.5,4.0,5.4
14-09-25,13:00,Brabrand IF vs BK Fremad Amager,Denmark 2nd Division,36836,Brabrand IF,BK Fremad Amager,3.0,3.33,2.15
14-09-25,12:00,Vejgaard BK vs Hoersholm-Usseroed IK,Denmark 3rd Division,37917,Vejgaard BK,Hoersholm-Usseroed IK,2.15,3.5,2.9
14-09-25,13:00,Bronshoj BK vs Naesby BK,Denmark 3rd Division,39300,Bronshoj BK,Naesby BK,2.7,3.4,2.3
14-09-25,13:00,Sundby BK vs IF Lyseng,Denmark 3rd Division,38361,Sundby BK,IF Lyseng,1.47,4.3,5.3
14-09-25,13:00,Vanloese IF vs BK Frem,Denmark 3rd Division,35091,Vanloese IF,BK Frem,2.2,3.5,2.8
14-09-25,14:00,Nykoebing FC vs Odder IGF,Denmark 3rd Division,44283,Nykoebing FC,Odder IGF,1.32,4.7,7.8
14-09-25,10:00,Cagliari Calcio vs AC Milan,Italy Primavera 1,39017,Cagliari Calcio,AC Milan,2.5,3.1,2.65
14-09-25,10:00,US Cremonese vs SS Lazio,Italy Primavera 1,38657,US Cremonese,SS Lazio,2.9,3.2,2.3
14-09-25,12:00,US Lecce vs AC Monza,Italy Primavera 1,42840,US Lecce,AC Monza,1.89,3.6,3.4
14-09-25,10:00,FC Crotone vs Palermo FC,Italy Primavera 2,15588,FC Crotone,Palermo FC,2.8,3.4,2.2
14-09-25,18:30,CSDC Alianza Universidad vs CS Cienciano,Peru Liga 1,18557,CSDC Alianza Universidad,CS Cienciano,2.45,3.25,2.8
14-09-25,21:00,FBC Melgar vs Universitario de Deportes,Peru Liga 1,22852,FBC Melgar,Universitario de Deportes,2.25,3.1,3.3
14-09-25,23:30,Cusco FC vs Sporting Cristal,Peru Liga 1,39130,Cusco FC,Sporting Cristal,1.96,3.4,3.75
14-09-25,16:00,CD Cobreloa Calama vs Deportes Recoleta,Chile Primera B,43697,CD Cobreloa Calama,Deportes Recoleta,1.86,3.5,3.9
14-09-25,16:00,CSD Rangers vs Union San Felipe,Chile Primera B,43698,CSD Rangers,Union San Felipe,2.4,3.1,2.95
14-09-25,21:30,San Marcos de Arica vs Deportes Concepcion,Chile Primera B,45032,San Marcos de Arica,Deportes Concepcion,2.55,3.0,2.8
14-09-25,21:30,Santiago Wanderers vs CD Santa Cruz,Chile Primera B,43684,Santiago Wanderers,CD Santa Cruz,1.76,3.6,4.25
14-09-25,19:30,Comunicaciones vs Argentino de Merlo,Argentina Primera B,41819,Comunicaciones,Argentino de Merlo,2.2,2.9,3.6
14-09-25,19:30,CSD Liniers vs Argentino de Quilmes,Argentina Primera B,34051,CSD Liniers,Argentino de Quilmes,2.5,2.85,3.0
14-09-25,19:30,CSD San Martin vs Club Atletico Acassuso,Argentina Primera B,45351,CSD San Martin,Club Atletico Acassuso,2.55,2.85,2.95
14-09-25,14:30,CA River Plate (URU) vs CA Progreso,Uruguay Primera Division,34024,CA River Plate (URU),CA Progreso,2.65,3.25,2.6
14-09-25,17:00,CA Juventud de Las Piedras vs Montevideo City Torque,Uruguay Primera Division,34038,CA Juventud de Las Piedras,Montevideo City Torque,2.7,3.3,2.5
14-09-25,19:30,Danubio FC vs CA Cerro,Uruguay Primera Division,34079,Danubio FC,CA Cerro,2.05,3.25,3.6
14-09-25,22:00,Plaza Colonia vs Club Nacional de Football,Uruguay Primera Division,11937,Plaza Colonia,Club Nacional de Football,6.4,4.0,1.51
14-09-25,00:30,Miramar Misiones vs Montevideo Wanderers,Uruguay Primera Division,34191,Miramar Misiones,Montevideo Wanderers,2.6,3.1,2.8
14-09-25,10:00,Club Deportiva Minera vs CD Estepona,Spain Segunda Federacion,29153,Club Deportiva Minera,CD Estepona,2.7,2.85,2.45
14-09-25,10:00,Real Madrid C vs UD Las Palmas Atletico,Spain Segunda Federacion,42273,Real Madrid C,UD Las Palmas Atletico,1.84,3.1,3.75
14-09-25,10:30,FC La Union Atletico vs Xerez Deportivo FC,Spain Segunda Federacion,19589,FC La Union Atletico,Xerez Deportivo FC,1.71,2.95,4.9
14-09-25,10:30,SD Beasain vs SD Ejea,Spain Segunda Federacion,40239,SD Beasain,SD Ejea,2.1,2.95,3.2
14-09-25,10:30,Yeclano Deportivo vs UD Melilla,Spain Segunda Federacion,26692,Yeclano Deportivo,UD Melilla,1.84,3.1,3.8
14-09-25,11:00,Burgos CF Promesas vs UD Ourense,Spain Segunda Federacion,20846,Burgos CF Promesas,UD Ourense,2.65,2.9,2.45
14-09-25,11:00,CD Ebro vs SD Amorebieta,Spain Segunda Federacion,43364,CD Ebro,SD Amorebieta,2.05,3.0,3.25
14-09-25,11:00,CD Tenerife B vs CD Quintanar del Rey,Spain Segunda Federacion,42329,CD Tenerife B,CD Quintanar del Rey,2.0,3.1,3.25
14-09-25,11:00,CF Fuenlabrada vs UD San Sebastian Reyes,Spain Segunda Federacion,42277,CF Fuenlabrada,UD San Sebastian Reyes,2.75,3.0,2.3
14-09-25,11:00,CF Rayo Majadahonda vs Orihuela CF,Spain Segunda Federacion,42274,CF Rayo Majadahonda,Orihuela CF,2.05,2.85,3.4
14-09-25,11:00,Girona FC B vs UD Poblense,Spain Segunda Federacion,43422,Girona FC B,UD Poblense,2.5,2.75,2.7
14-09-25,11:00,Real Valladolid Promesas vs Gimnastica Segoviana CF,Spain Segunda Federacion,41672,Real Valladolid Promesas,Gimnastica Segoviana CF,2.3,3.0,2.75
14-09-25,11:00,RSD Alcala vs UB Conquense,Spain Segunda Federacion,42275,RSD Alcala,UB Conquense,2.2,3.0,2.95
14-09-25,11:00,Salamanca CF UDS vs Atletico Astorga FC,Spain Segunda Federacion,21505,Salamanca CF UDS,Atletico Astorga FC,1.86,2.95,4.0
14-09-25,11:00,UE Olot vs CD Ibiza Islas Pitiusas,Spain Segunda Federacion,43483,UE Olot,CD Ibiza Islas Pitiusas,1.92,2.95,3.7
14-09-25,11:00,UE Porreres vs Atletic Lleida CE,Spain Segunda Federacion,43524,UE Porreres,Atletic Lleida CE,2.85,3.1,2.2
14-09-25,11:00,Valencia CF Mestalla vs CD Atletico Baleares,Spain Segunda Federacion,32840,Valencia CF Mestalla,CD Atletico Baleares,2.55,2.8,2.6
14-09-25,11:30,SD Eibar B vs Alfaro CD,Spain Segunda Federacion,45221,SD Eibar B,Alfaro CD,1.59,3.6,4.5
14-09-25,16:00,CD Numancia vs Rayo Cantabria,Spain Segunda Federacion,45190,CD Numancia,Rayo Cantabria,1.6,3.25,5.0
14-09-25,16:00,Coruxo FC vs RC Deportivo Fabril,Spain Segunda Federacion,43546,Coruxo FC,RC Deportivo Fabril,2.7,2.7,2.55
14-09-25,16:00,Espanyol Barcelona B vs UD Barbastro,Spain Segunda Federacion,45191,Espanyol Barcelona B,UD Barbastro,1.78,2.95,4.3
14-09-25,16:00,SD Sarriana vs CD Lealtad de Villaviciosa,Spain Segunda Federacion,43550,SD Sarriana,CD Lealtad de Villaviciosa,1.82,3.1,3.9
14-09-25,16:00,UE Sant Andreu vs CD Alcoyano,Spain Segunda Federacion,41339,UE Sant Andreu,CD Alcoyano,1.87,3.1,3.7
14-09-25,17:00,CD Linares vs Aguilas FC,Spain Segunda Federacion,43599,CD Linares,Aguilas FC,2.6,2.6,2.8
14-09-25,17:00,CDA Navalcarnero vs Rayo Vallecano B,Spain Segunda Federacion,42330,CDA Navalcarnero,Rayo Vallecano B,1.78,3.2,3.9
14-09-25,17:00,Real Avila CF vs Bergantinos FC,Spain Segunda Federacion,45192,Real Avila CF,Bergantinos FC,2.1,2.75,3.4
14-09-25,17:00,Real Union de Irun vs CD Tudelano,Spain Segunda Federacion,45193,Real Union de Irun,CD Tudelano,1.66,3.25,4.6
14-09-25,17:00,Terrassa FC vs Torrent CF,Spain Segunda Federacion,43592,Terrassa FC,Torrent CF,1.97,2.85,3.7
14-09-25,17:00,UD Logrones vs Naxara CD,Spain Segunda Federacion,45197,UD Logrones,Naxara CD,1.21,4.7,11.5
14-09-25,17:30,CD Coria vs Getafe CF B,Spain Segunda Federacion,42331,CD Coria,Getafe CF B,2.05,2.95,3.33
14-09-25,17:30,RC Recreativo de Huelva vs Puente Genil FC,Spain Segunda Federacion,45198,RC Recreativo de Huelva,Puente Genil FC,1.55,3.3,5.5
14-09-25,17:30,Sestao River Club vs Real Zaragoza Deportivo Aragon,Spain Segunda Federacion,45194,Sestao River Club,Real Zaragoza Deportivo Aragon,1.47,3.5,6.0
14-09-25,17:30,UD Socuellamos CF vs Colonia Moscardo,Spain Segunda Federacion,42259,UD Socuellamos CF,Colonia Moscardo,2.1,3.1,3.0
14-09-25,18:00,CD Xerez vs CA Antoniano,Spain Segunda Federacion,43620,CD Xerez,CA Antoniano,2.05,2.8,3.6
14-09-25,18:00,CF Intercity vs Elche Ilicitano CF,Spain Segunda Federacion,42341,CF Intercity,Elche Ilicitano CF,1.85,3.2,3.6
14-09-25,18:00,Real Jaen CF vs CD Extremadura,Spain Segunda Federacion,45380,Real Jaen CF,CD Extremadura,2.1,3.1,2.95
14-09-25,18:30,UCAM Murcia vs CF Lorca Deportiva,Spain Segunda Federacion,45287,UCAM Murcia,CF Lorca Deportiva,1.65,3.1,4.9
14-09-25,19:00,MALAGA B vs UD Almeria B,Spain Segunda Federacion,45275,MALAGA B,UD Almeria B,2.2,2.95,2.95
14-09-25,09:30,Psim Yogyakarta vs Borneo Samarinda,Indonesia Super League,44490,Psim Yogyakarta,Borneo Samarinda,2.75,3.25,2.45
14-09-25,13:00,Persija Jakarta vs Bali United FC,Indonesia Super League,35359,Persija Jakarta,Bali United FC,1.78,3.7,4.1
14-09-25,14:00,FK Radnicki Nis vs FK Napredak Krusevac,Serbia Superliga,29591,FK Radnicki Nis,FK Napredak Krusevac,2.05,3.5,3.4
14-09-25,16:00,Backa Topola vs FK Mladost Lucani,Serbia Superliga,18672,Backa Topola,FK Mladost Lucani,1.59,4.1,5.1
14-09-25,16:00,Crvena Zvezda vs FK Zeleznicar Pancevo,Serbia Superliga,27266,Crvena Zvezda,FK Zeleznicar Pancevo,1.14,8.25,14.5
14-09-25,18:30,FK Spartak Subotica vs FK Partizan Belgrade,Serbia Superliga,18477,FK Spartak Subotica,FK Partizan Belgrade,6.0,4.3,1.49
14-09-25,14:00,Bandirmaspor vs Ankara Keciorengucu,Turkiye 1. Lig,38566,Bandirmaspor,Ankara Keciorengucu,1.77,3.75,4.2
14-09-25,14:00,Igdir FK vs Serik Belediyespor,Turkiye 1. Lig,38354,Igdir FK,Serik Belediyespor,1.41,4.6,7.0
14-09-25,17:00,Amed Sportif Faaliyetler vs Pendikspor,Turkiye 1. Lig,39547,Amed Sportif Faaliyetler,Pendikspor,1.65,3.9,4.75
14-09-25,18:00,Difaa Hassani d'el-Jadida vs CODM Meknes,Morocco Botola Pro D1,11430,Difaa Hassani d'el-Jadida,CODM Meknes,1.92,3.25,4.2
14-09-25,20:00,Maghreb AS de Fes vs Renaissance Zemamra,Morocco Botola Pro D1,12800,Maghreb AS de Fes,Renaissance Zemamra,1.83,3.2,4.7
14-09-25,13:30,SK Rapid vs WSG Tirol,Austria Bundesliga,37596,SK Rapid,WSG Tirol,1.53,4.4,5.6
14-09-25,16:00,Sturm Graz vs FK Austria Wien,Austria Bundesliga,37489,Sturm Graz,FK Austria Wien,1.94,3.6,3.8
14-09-25,11:00,Gd Chaves B vs AD Machico,Portugal Campeonato de Portugal,21341,Gd Chaves B,AD Machico,1.95,3.5,3.33
14-09-25,14:00,SC Lusitania Angra vs Ass Naval 1º de Maio,Portugal Campeonato de Portugal,45772,SC Lusitania Angra,Ass Naval 1º de Maio,1.85,3.5,3.7
14-09-25,15:00,AC Marinhense vs Mortagua FC,Portugal Campeonato de Portugal,14460,AC Marinhense,Mortagua FC,2.15,2.8,3.6
14-09-25,15:00,Aparecida FC vs Anadia FC,Portugal Campeonato de Portugal,19827,Aparecida FC,Anadia FC,2.6,3.4,2.4
14-09-25,15:00,At Malveira vs Clube Oriental de Lisboa,Portugal Campeonato de Portugal,42345,At Malveira,Clube Oriental de Lisboa,2.1,2.95,3.5
14-09-25,15:00,Desportivo Moncao vs Vilaverdense FC,Portugal Campeonato de Portugal,19768,Desportivo Moncao,Vilaverdense FC,2.6,3.7,2.25
14-09-25,15:00,FC Oliveira do Hospital vs CD Fatima,Portugal Campeonato de Portugal,45781,FC Oliveira do Hospital,CD Fatima,1.66,3.2,5.4
14-09-25,15:00,FC Tirsense vs Brito SC,Portugal Campeonato de Portugal,22186,FC Tirsense,Brito SC,1.85,3.33,3.8
14-09-25,15:00,Florgrade FC vs CD Cinfaes,Portugal Campeonato de Portugal,25741,Florgrade FC,CD Cinfaes,2.35,3.0,2.9
14-09-25,15:00,Gd Peniche vs Gd Samora Correia,Portugal Campeonato de Portugal,45777,Gd Peniche,Gd Samora Correia,1.82,3.4,3.9
14-09-25,15:00,Leca FC vs FC Alpendorada,Portugal Campeonato de Portugal,18182,Leca FC,FC Alpendorada,2.0,3.25,3.33
14-09-25,15:00,LGC Moncarapachense vs FC Serpa,Portugal Campeonato de Portugal,42350,LGC Moncarapachense,FC Serpa,2.05,3.2,3.33
14-09-25,15:00,Louletano DC vs Juventude SC Evora,Portugal Campeonato de Portugal,42373,Louletano DC,Juventude SC Evora,1.73,3.4,4.4
14-09-25,15:00,Portimonense SC B vs FC Alverca B,Portugal Campeonato de Portugal,42470,Portimonense SC B,FC Alverca B,2.55,2.9,2.75
14-09-25,15:00,Rebordosa AC vs CD Gouveia,Portugal Campeonato de Portugal,23243,Rebordosa AC,CD Gouveia,1.57,3.6,5.5
14-09-25,15:00,SC Mirandela vs CD Celoricense,Portugal Campeonato de Portugal,21382,SC Mirandela,CD Celoricense,2.3,3.1,2.95
14-09-25,15:00,SC Salgueiros vs Atletico de Vila Mea,Portugal Campeonato de Portugal,18219,SC Salgueiros,Atletico de Vila Mea,1.91,3.2,3.9
14-09-25,15:00,SC Vianense vs Ar Sao Martinho,Portugal Campeonato de Portugal,11367,SC Vianense,Ar Sao Martinho,1.72,3.33,4.6
14-09-25,15:00,SC Vila Real vs CF Uniao de Lamas,Portugal Campeonato de Portugal,18728,SC Vila Real,CF Uniao de Lamas,2.05,3.25,3.33
14-09-25,15:00,Sport Benfica Castelo Branco vs GD Vitoria Sernache,Portugal Campeonato de Portugal,28296,Sport Benfica Castelo Branco,GD Vitoria Sernache,2.75,2.95,2.5
14-09-25,15:00,Uf Comercio E Industria Setubal vs GD Lagoa,Portugal Campeonato de Portugal,42306,Uf Comercio E Industria Setubal,GD Lagoa,2.85,2.95,2.45
14-09-25,15:00,Uniao Serra vs Os Marialvas,Portugal Campeonato de Portugal,45802,Uniao Serra,Os Marialvas,2.4,3.2,2.7
14-09-25,15:00,Vasco da Gama Vidigueira vs Alcochetense,Portugal Campeonato de Portugal,42364,Vasco da Gama Vidigueira,Alcochetense,3.25,3.0,2.2
14-09-25,12:30,Heilongjiang Ice City vs Chongqing Tonglianglong FC,China China League 1,43520,Heilongjiang Ice City,Chongqing Tonglianglong FC,5.1,3.7,1.66
14-09-25,12:30,Nantong Zhiyun vs Suzhou Dongwu,China China League 1,39512,Nantong Zhiyun,Suzhou Dongwu,2.15,3.1,3.6
14-09-25,12:30,Qingdao Red Lions vs Foshan Nanshi FC,China China League 1,43519,Qingdao Red Lions,Foshan Nanshi FC,2.15,3.1,3.6
14-09-25,09:00,Guangzhou Dandelion Alpha FC vs Rizhao Yuqi,China China League 2,44128,Guangzhou Dandelion Alpha FC,Rizhao Yuqi,1.94,3.1,3.4
14-09-25,09:00,Shanghai Port B vs Guangdong Mingtu,China China League 2,45286,Shanghai Port B,Guangdong Mingtu,1.79,3.2,3.9
14-09-25,10:30,Quanzhou Yaxin vs Langfang Glory City FC,China China League 2,27945,Quanzhou Yaxin,Langfang Glory City FC,4.1,3.0,1.82
14-09-25,12:00,Shandong Taishan B vs Guizhou Zhucheng Athletic,China China League 2,20311,Shandong Taishan B,Guizhou Zhucheng Athletic,2.55,2.95,2.7
14-09-25,12:30,Guangxi Hengchen FC vs Changchun Xidu,China China League 2,22054,Guangxi Hengchen FC,Changchun Xidu,1.53,3.6,6.0
14-09-25,12:30,Jiangxi Beidamen vs Guangxi Lanhang,China China League 2,41910,Jiangxi Beidamen,Guangxi Lanhang,1.17,5.2,12.0
14-09-25,11:15,LKP Motor Lublin vs Bruk-Bet Termalica Nieciecza,Poland Ekstraklasa,36791,LKP Motor Lublin,Bruk-Bet Termalica Nieciecza,2.15,3.7,3.1
14-09-25,13:45,Legia Warszawa vs RKS Radomiak Radom,Poland Ekstraklasa,37018,Legia Warszawa,RKS Radomiak Radom,1.55,4.25,5.6
14-09-25,16:30,Widzew Lodz vs MKS Arka Gdynia,Poland Ekstraklasa,37037,Widzew Lodz,MKS Arka Gdynia,1.54,4.2,5.8
14-09-25,10:30,Viimsi JK vs Tartu JK Tammeka U21,Estonia Esiliiga,22334,Viimsi JK,Tartu JK Tammeka U21,1.01,11.0,47.0
14-09-25,17:00,Bentin Tacna Heroica vs CD Universidad Cesar Vallejo,Peru Liga 2,29112,Bentin Tacna Heroica,CD Universidad Cesar Vallejo,2.1,3.25,3.1
14-09-25,21:00,Ucv Moquegua vs Carlos Mannucci,Peru Liga 2,20797,Ucv Moquegua,Carlos Mannucci,1.87,3.4,3.7
14-09-25,23:30,FC San Marcos vs Santos FC Nasca,Peru Liga 2,29756,FC San Marcos,Santos FC Nasca,2.25,3.4,2.7
14-09-25,19:00,Leones Negros UDEG vs Club Atletico La Paz,"Mexico Liga de Expansion MX, Apertura",22381,Leones Negros UDEG,Club Atletico La Paz,1.55,4.3,5.0
14-09-25,11:00,Portimonense SC vs Sporting Lisbon B,Portugal Liga Portugal 2,12939,Portimonense SC,Sporting Lisbon B,2.6,3.33,2.6
14-09-25,14:00,Maritimo Madeira vs FC Vizela,Portugal Liga Portugal 2,22730,Maritimo Madeira,FC Vizela,2.8,3.2,2.5
14-09-25,15:30,FC Porto B vs UD Leiria,Portugal Liga Portugal 2,31862,FC Porto B,UD Leiria,3.4,3.33,2.05
14-09-25,15:30,SCU Torreense vs FC Pacos Ferreira,Portugal Liga Portugal 2,31953,SCU Torreense,FC Pacos Ferreira,1.64,3.6,5.4
14-09-25,18:00,GD Chaves vs CD Feirense,Portugal Liga Portugal 2,27727,GD Chaves,CD Feirense,2.0,3.2,3.8
14-09-25,17:45,CD El Nacional vs CSD Macara,Ecuador LigaPro Primera A,33259,CD El Nacional,CSD Macara,2.55,3.2,2.7
14-09-25,20:00,CD Tecnico Universitario vs CD Cuenca,Ecuador LigaPro Primera A,11869,CD Tecnico Universitario,CD Cuenca,2.3,3.2,3.0
14-09-25,23:30,CS Emelec vs Barcelona SC,Ecuador LigaPro Primera A,17630,CS Emelec,Barcelona SC,2.8,3.1,2.5
14-09-25,11:00,FC Vorskla Poltava vs Agrobiznes Volochisk,Ukraine Persha Liga,12352,FC Vorskla Poltava,Agrobiznes Volochisk,1.8,3.1,4.0
14-09-25,13:00,Yuksa Tarasivka vs FC Ingulets Petrove,Ukraine Persha Liga,25350,Yuksa Tarasivka,FC Ingulets Petrove,3.9,3.3,1.75
14-09-25,12:30,FC Kuressaare vs JK Tallinna Kalev,Estonia Premium Liiga,32951,FC Kuressaare,JK Tallinna Kalev,1.92,3.7,3.4
14-09-25,12:30,Paide Linnameeskond vs Nomme Kalju FC,Estonia Premium Liiga,22104,Paide Linnameeskond,Nomme Kalju FC,2.3,3.5,2.75
14-09-25,15:00,JK Narva Trans vs Harju JK Laagri,Estonia Premium Liiga,22132,JK Narva Trans,Harju JK Laagri,1.4,4.8,6.25
14-09-25,11:00,Atletico Madrid B vs Real Murcia CF,Spain Primera Federacion,41529,Atletico Madrid B,Real Murcia CF,2.6,3.1,2.55
14-09-25,11:00,Juventud Torremolinos CF vs SD Tarazona,Spain Primera Federacion,41530,Juventud Torremolinos CF,SD Tarazona,2.4,2.9,2.95
14-09-25,11:00,Ourense CF vs CF Talavera de La Reina,Spain Primera Federacion,40045,Ourense CF,CF Talavera de La Reina,2.25,3.0,3.0
14-09-25,11:00,Real Aviles CF vs CA Osasuna B,Spain Primera Federacion,40047,Real Aviles CF,CA Osasuna B,2.15,3.2,3.1
14-09-25,15:00,Athletic Bilbao B vs Real Madrid Castilla,Spain Primera Federacion,40063,Athletic Bilbao B,Real Madrid Castilla,1.89,3.6,3.4
14-09-25,15:00,CP Cacereno SAD vs CD Arenteiro,Spain Primera Federacion,40065,CP Cacereno SAD,CD Arenteiro,2.3,2.95,3.0
14-09-25,17:15,CD Guadalajara vs Unionistas de Salamanca CF,Spain Primera Federacion,40068,CD Guadalajara,Unionistas de Salamanca CF,2.25,3.2,2.95
14-09-25,17:15,Pontevedra CF vs Tenerife CD,Spain Primera Federacion,37035,Pontevedra CF,Tenerife CD,3.5,2.95,2.1
14-09-25,17:15,Zamora CF vs CD Lugo,Spain Primera Federacion,40074,Zamora CF,CD Lugo,2.05,3.0,3.6
14-09-25,19:30,Racing Club de Ferrol vs SD Ponferradina,Spain Primera Federacion,40082,Racing Club de Ferrol,SD Ponferradina,2.0,3.25,3.4
14-09-25,17:30,Nueva Chicago vs Gimnasia y Esgrima de Jujuy,Argentina Primera Nacional,17781,Nueva Chicago,Gimnasia y Esgrima de Jujuy,3.0,2.75,2.55
14-09-25,19:00,CSD Tristan Suarez vs CA Colegiales,Argentina Primera Nacional,34551,CSD Tristan Suarez,CA Colegiales,1.85,2.95,5.0
14-09-25,19:30,CA Talleres de Remedios vs Colon de Santa Fe,Argentina Primera Nacional,24474,CA Talleres de Remedios,Colon de Santa Fe,2.75,2.95,2.65
14-09-25,19:30,Chacarita Juniors vs Almirante Brown,Argentina Primera Nacional,17878,Chacarita Juniors,Almirante Brown,1.97,2.9,4.4
14-09-25,19:30,Club Atletico Los Andes vs Club Almagro,Argentina Primera Nacional,22269,Club Atletico Los Andes,Club Almagro,2.5,2.65,3.3
14-09-25,20:00,CA Guemes vs Racing de Cordoba,Argentina Primera Nacional,18456,CA Guemes,Racing de Cordoba,1.84,3.1,4.7
14-09-25,20:00,CA Patronato Parana vs Quilmes AC,Argentina Primera Nacional,34706,CA Patronato Parana,Quilmes AC,2.15,2.85,3.75
14-09-25,20:00,CD Maipu vs CA All Boys,Argentina Primera Nacional,14651,CD Maipu,CA All Boys,1.9,3.0,4.6
14-09-25,20:30,Deportivo Madryn vs CA Alvarado,Argentina Primera Nacional,32489,Deportivo Madryn,CA Alvarado,1.59,3.25,6.9
14-09-25,21:00,CA San Telmo vs Central Norte Salta,Argentina Primera Nacional,27414,CA San Telmo,Central Norte Salta,2.1,2.95,3.7
14-09-25,23:00,Estudiantes Rio Cuarto vs Mitre Santiago Del Estero,Argentina Primera Nacional,23668,Estudiantes Rio Cuarto,Mitre Santiago Del Estero,1.79,3.0,5.25
14-09-25,00:00,San Martin de Tucuman vs Club Atletico Atlanta,Argentina Primera Nacional,32338,San Martin de Tucuman,Club Atletico Atlanta,2.45,2.8,3.2
14-09-25,15:00,FK Kabel Novi Sad vs FK Zemun,Serbia Prva Liga,33339,FK Kabel Novi Sad,FK Zemun,3.0,2.8,2.25
14-09-25,15:00,FK Tekstilac Odzaci vs FK Smederevo 1924,Serbia Prva Liga,16930,FK Tekstilac Odzaci,FK Smederevo 1924,2.1,2.85,3.25
14-09-25,18:00,FK Jedinstvo UB vs FK Borac Cacak,Serbia Prva Liga,38541,FK Jedinstvo UB,FK Borac Cacak,1.71,3.1,4.4
14-09-25,14:30,Albion FC vs Deportivo Maldonado,Uruguay Segunda Division,10731,Albion FC,Deportivo Maldonado,1.87,3.0,4.2
14-09-25,15:00,CA Artigas vs Tacuarembo FC,Uruguay Segunda Division,44837,CA Artigas,Tacuarembo FC,2.7,2.95,2.55
14-09-25,16:00,Rampla Juniors vs CS Cerrito,Uruguay Segunda Division,35041,Rampla Juniors,CS Cerrito,2.0,3.1,3.7
14-09-25,19:00,Uruguay Montevideo FC vs Club Oriental de Football,Uruguay Segunda Division,42041,Uruguay Montevideo FC,Club Oriental de Football,2.55,3.0,2.65
14-09-25,15:00,Anagennisi Karditsas 1904 vs Makedonikos FC,Greece Super League 2,39267,Anagennisi Karditsas 1904,Makedonikos FC,1.39,3.9,8.1
14-09-25,15:00,Chania FC vs Hellas Syrou,Greece Super League 2,33960,Chania FC,Hellas Syrou,1.75,3.33,4.4
14-09-25,15:00,Nestos Chrysoupoli FC vs PAS Giannina,Greece Super League 2,33931,Nestos Chrysoupoli FC,PAS Giannina,1.86,3.33,3.75
14-09-25,15:00,Olympiacos Piraeus B vs Panionios Athens,Greece Super League 2,39404,Olympiacos Piraeus B,Panionios Athens,4.75,3.5,1.67
14-09-25,16:00,MFK Zemplin Michalovce vs 1. FC Tatran Presov,Slovakia Superliga,28668,MFK Zemplin Michalovce,1. FC Tatran Presov,2.3,3.5,2.85
14-09-25,18:00,DAC 1904 Dunajska Streda vs FK Zeleziarne Podbrezova,Slovakia Superliga,40569,DAC 1904 Dunajska Streda,FK Zeleziarne Podbrezova,1.44,4.6,6.3
14-09-25,14:00,FF Jaro vs AC Oulu,Finland Veikkausliiga,24401,FF Jaro,AC Oulu,2.75,3.5,2.3
14-09-25,14:00,Kuopion Palloseura vs Tampereen Ilves,Finland Veikkausliiga,21162,Kuopion Palloseura,Tampereen Ilves,2.25,3.8,2.8
14-09-25,14:00,FK Metta / Lu vs SK Super Nova,Latvia Virsliga,13161,FK Metta / Lu,SK Super Nova,2.45,3.4,2.6
14-09-25,17:00,FK Liepaja vs FK Tukums 2000/TSS,Latvia Virsliga,16904,FK Liepaja,FK Tukums 2000/TSS,1.29,5.4,8.5
14-09-25,11:00,Miedz Legnica vs Polonia Warszawa,Poland 1. Liga,23101,Miedz Legnica,Polonia Warszawa,2.3,3.5,2.85
14-09-25,14:30,Ruch Chorzow vs LKS Lodz,Poland 1. Liga,23219,Ruch Chorzow,LKS Lodz,2.4,3.33,2.75
14-09-25,16:30,Pogon Grodzisk Mazowiecki vs Gornik Leczna,Poland 1. Liga,32835,Pogon Grodzisk Mazowiecki,Gornik Leczna,1.97,3.7,3.33
14-09-25,12:00,Marupes SC vs JDFS Alberts,Latvia 1.Liga,27037,Marupes SC,JDFS Alberts,6.0,4.9,1.38
14-09-25,15:00,Leevon Ppk vs FK Rfs II,Latvia 1.Liga,35830,Leevon Ppk,FK Rfs II,2.55,3.7,2.3
14-09-25,18:00,Ogre United vs Augsdaugavas NSS,Latvia 1.Liga,32358,Ogre United,Augsdaugavas NSS,1.18,6.1,11.0
14-09-25,09:30,FC Liefering vs Austria Salzburg,Austria 2. Liga,44371,FC Liefering,Austria Salzburg,1.99,3.75,3.33
14-09-25,09:30,Sriwijaya FC vs Garuda Yaksa,Indonesia Championship,17068,Sriwijaya FC,Garuda Yaksa,2.6,3.1,2.4
14-09-25,13:00,PSIS Semarang vs Persiku Kudus,Indonesia Championship,23627,PSIS Semarang,Persiku Kudus,2.05,3.3,3.25
14-09-25,17:00,FC Saburtalo Tbilisi vs FC Kolkheti-1913 Poti,Georgia Erovnuli Liga,42583,FC Saburtalo Tbilisi,FC Kolkheti-1913 Poti,1.23,5.2,10.5
14-09-25,18:00,FC Dila Gori vs FC Dinamo Batumi,Georgia Erovnuli Liga,16667,FC Dila Gori,FC Dinamo Batumi,1.54,3.7,5.7
14-09-25,12:00,Team TG FF vs Enkopings SK,"Sweden Ettan, Norra",39333,Team TG FF,Enkopings SK,4.75,4.3,1.57
14-09-25,15:00,Vasalunds IF vs Assyriska FF,"Sweden Ettan, Norra",43634,Vasalunds IF,Assyriska FF,1.84,3.9,3.6
14-09-25,15:00,Eskilsminne IF vs Norrby IF,"Sweden Ettan, Sodra",40583,Eskilsminne IF,Norrby IF,2.9,3.5,2.2
14-09-25,15:00,Lunds BK vs Jonkopings Sodra IF,"Sweden Ettan, Sodra",40584,Lunds BK,Jonkopings Sodra IF,2.85,3.33,2.35
14-09-25,09:15,FK Viktoria Zizkov vs FC Zbrojovka Brno,Czechia FNL,34800,FK Viktoria Zizkov,FC Zbrojovka Brno,4.2,3.8,1.72
14-09-25,22:00,CD Marathon San Pedro Sula vs Atletico Choloma,"Honduras Liga Nacional, Apertura",31692,CD Marathon San Pedro Sula,Atletico Choloma,1.08,8.5,26.0
14-09-25,00:15,Olancho FC vs Platense FC Puerto Cortes,"Honduras Liga Nacional, Apertura",40615,Olancho FC,Platense FC Puerto Cortes,1.53,4.0,5.75
14-09-25,15:30,AD Marco 09 vs Amarante FC,Portugal Liga Portugal 3,40613,AD Marco 09,Amarante FC,2.4,2.85,3.0
14-09-25,15:30,Amora FC vs UD Santarem,Portugal Liga Portugal 3,40617,Amora FC,UD Santarem,2.6,2.95,2.65
14-09-25,17:00,Caldas SC vs 1 Dezembro,Portugal Liga Portugal 3,33064,Caldas SC,1 Dezembro,2.05,3.0,3.6
14-09-25,17:00,SC Covilha vs CD Mafra,Portugal Liga Portugal 3,40621,SC Covilha,CD Mafra,2.55,3.2,2.5
14-09-25,12:30,Balestier Khalsa FC vs Lion City Sailors FC,Singapore Premier League,42258,Balestier Khalsa FC,Lion City Sailors FC,4.7,4.8,1.52
14-09-25,18:00,Deportivo Saprissa San Jose vs Guadalupe FC,"Costa Rica Primera Division, Apertura",43165,Deportivo Saprissa San Jose,Guadalupe FC,1.29,5.2,9.0
