date,time,title,tournament,game-id,home-team,away-team,pre-match_odds_home,pre-match_odds_draw,pre-match_odds_away
12-09-25,19:00,FC Emmen vs TOP Oss,Netherlands Eerste Divisie,41224,FC Emmen,TOP Oss,1.61,4.2,5.0
12-09-25,19:00,Jong AZ Alkmaar vs Vitesse Arnhem,Netherlands Eerste Divisie,26216,Jong AZ Alkmaar,Vitesse Arnhem,1.26,6.4,9.3
12-09-25,19:00,Jong FC Utrecht vs RKC Waalwijk,Netherlands Eerste Divisie,41247,Jong FC Utrecht,RKC Waalwijk,3.5,3.9,1.94
12-09-25,19:00,MVV Maastricht vs SC Cambuur,Netherlands Eerste Divisie,41229,MVV Maastricht,SC Cambuur,4.6,4.1,1.68
12-09-25,19:00,Roda JC Kerkrade vs Jong Ajax Amsterdam,Netherlands Eerste Divisie,41235,Roda JC Kerkrade,Jong Ajax Amsterdam,1.6,4.25,5.1
12-09-25,19:30,Drogheda United FC vs Shamrock Rovers,Ireland FAI Cup,27506,Drogheda United FC,Shamrock Rovers,5.0,3.33,1.73
12-09-25,19:45,Finn Harps FC vs Cork City FC,Ireland FAI Cup,25882,Finn Harps FC,Cork City FC,3.5,3.1,2.15
12-09-25,19:45,Kerry FC vs Sligo Rovers FC,Ireland FAI Cup,31527,Kerry FC,Sligo Rovers FC,4.8,3.75,1.65
12-09-25,09:00,Sevilla SRL vs CF Elche SRL,Simulated Reality League LaLiga SRL,38327,Sevilla SRL,CF Elche SRL,2.02,3.34,3.94
12-09-25,11:00,Marseille SRL vs FC Lorient SRL,Simulated Reality League Ligue 1 SRL,39349,Marseille SRL,FC Lorient SRL,1.34,5.56,7.92
12-09-25,11:00,Ural Ekaterinburg vs FC Krasnodar,"Russia MFL, Division A",38206,Ural Ekaterinburg,FC Krasnodar,8.5,6.1,1.18
12-09-25,13:00,FK Nizhny Novgorod vs Dinamo Moscow,"Russia MFL, Division A",41038,FK Nizhny Novgorod,Dinamo Moscow,5.0,3.25,1.6
12-09-25,13:00,Rubin Kazan vs Football Academy Of Konoplev,"Russia MFL, Division A",41044,Rubin Kazan,Football Academy Of Konoplev,1.88,3.0,3.7
12-09-25,13:00,Samara Kryliya Sovetov vs CSKA Moscow,"Russia MFL, Division A",41082,Samara Kryliya Sovetov,CSKA Moscow,4.75,4.2,1.47
12-09-25,15:00,FK Zenit St. Petersburg vs FC Akhmat Grozny,"Russia MFL, Division A",41090,FK Zenit St. Petersburg,FC Akhmat Grozny,1.14,6.2,10.5
12-09-25,15:00,Lokomotiv Moscow vs FC Fakel Voronezh Youth,"Russia MFL, Division A",42018,Lokomotiv Moscow,FC Fakel Voronezh Youth,1.3,4.6,6.9
12-09-25,15:00,PFK Sochi vs FK Rostov,"Russia MFL, Division A",41945,PFK Sochi,FK Rostov,2.5,3.0,2.5
12-09-25,17:00,FC Baltika Kaliningrad vs FK Spartak Moscow,"Russia MFL, Division A",41648,FC Baltika Kaliningrad,FK Spartak Moscow,10.0,4.7,1.22
12-09-25,18:00,New England Revolution II vs Toronto FC II,USA MLS Next Pro,40564,New England Revolution II,Toronto FC II,1.65,4.1,4.3
12-09-25,00:00,Crown Legacy FC vs Chattanooga FC,USA MLS Next Pro,43931,Crown Legacy FC,Chattanooga FC,1.79,3.9,3.8
12-09-25,18:30,Dijon vs FC Villefranche-Beaujolais,France National,39569,Dijon,FC Villefranche-Beaujolais,1.6,3.75,5.7
12-09-25,18:30,FC Versailles 78 vs US Concarneau,France National,39687,FC Versailles 78,US Concarneau,2.15,3.25,3.4
12-09-25,18:30,LB Chateauroux vs Stade Briochin,France National,28395,LB Chateauroux,Stade Briochin,2.25,3.1,3.3
12-09-25,18:30,Le Puy Foot 43 Auvergne vs FC Rouen,France National,28401,Le Puy Foot 43 Auvergne,FC Rouen,2.4,3.2,3.0
12-09-25,18:30,Quevilly-Rouen Metropole vs Aubagne FC,France National,39593,Quevilly-Rouen Metropole,Aubagne FC,2.45,3.1,2.9
12-09-25,18:30,Sochaux-Montbeliard vs SM Caen,France National,45138,Sochaux-Montbeliard,SM Caen,1.93,3.4,3.8
12-09-25,18:30,US Orleans vs Football Bourg-En-Bresse Peronnas 01,France National,39574,US Orleans,Football Bourg-En-Bresse Peronnas 01,1.81,3.5,4.3
12-09-25,18:30,Valenciennes FC vs Paris 13 Atletico,France National,39624,Valenciennes FC,Paris 13 Atletico,1.97,3.25,3.9
12-09-25,10:30,Central Coast Mariners Academy vs SD Raiders FC,Australia NSW NPL 1,23231,Central Coast Mariners Academy,SD Raiders FC,2.1,3.8,2.8
12-09-25,11:00,North Eastern Metrostars SC vs Croydon FC,Australia South Australia NPL,15090,North Eastern Metrostars SC,Croydon FC,1.65,3.9,4.2
12-09-25,00:00,Charlotte Independence vs FC Naples,USA USL League One,43764,Charlotte Independence,FC Naples,2.1,3.6,3.1
12-09-25,18:00,B93 Copenhagen vs Aarhus Fremad,Denmark 1. Division,16710,B93 Copenhagen,Aarhus Fremad,2.7,3.7,2.4
12-09-25,16:30,La Viena FC vs Maleyat Kafr El Zayat,Egypt 2. Division A,35621,La Viena FC,Maleyat Kafr El Zayat,1.82,3.0,4.5
12-09-25,18:30,Telecom Egypt vs Aswan FC,Egypt 2. Division A,40368,Telecom Egypt,Aswan FC,2.9,2.45,2.85
12-09-25,16:25,Al-Jabil vs Jeddah Club,Saudi Arabia Division 1,30256,Al-Jabil,Jeddah Club,2.2,2.9,3.3
12-09-25,16:50,Al Bukiryah vs Al-Orobah,Saudi Arabia Division 1,30260,Al Bukiryah,Al-Orobah,2.35,3.1,2.9
12-09-25,18:40,AL Adalh FC vs Al-Raed Club,Saudi Arabia Division 1,29088,AL Adalh FC,Al-Raed Club,3.6,3.3,1.93
12-09-25,18:00,FC Roskilde vs AB Gladsaxe,Denmark 2nd Division,34991,FC Roskilde,AB Gladsaxe,2.45,3.6,2.4
12-09-25,19:00,UTC de Cajamarca vs Ayacucho FC,Peru Liga 1,13074,UTC de Cajamarca,Ayacucho FC,2.15,3.2,3.5
12-09-25,21:15,Sport Huancayo vs Los Chankas CYC,Peru Liga 1,17232,Sport Huancayo,Los Chankas CYC,1.57,4.0,5.4
12-09-25,20:00,Santiago Morning vs Universidad de Concepcion,Chile Primera B,26497,Santiago Morning,Universidad de Concepcion,2.8,3.0,2.55
12-09-25,09:30,Persib Bandung vs Persebaya Surabaya,Indonesia Super League,17542,Persib Bandung,Persebaya Surabaya,1.55,3.9,5.7
12-09-25,09:30,Persik Kediri vs Malut United,Indonesia Super League,28711,Persik Kediri,Malut United,2.3,3.4,2.8
12-09-25,13:00,Madura United vs Bhayangkara Presisi Indonesia FC,Indonesia Super League,28343,Madura United,Bhayangkara Presisi Indonesia FC,2.6,3.33,2.55
12-09-25,15:00,Esenler Erokspor vs Hatayspor Antakya,Turkiye 1. Lig,40736,Esenler Erokspor,Hatayspor Antakya,1.79,3.8,4.0
12-09-25,18:00,BB Bodrumspor vs Adana Demirspor,Turkiye 1. Lig,40942,BB Bodrumspor,Adana Demirspor,1.02,14.0,57.0
12-09-25,14:40,Al Dhafra SSC vs Dibba,United Arab Emirates Arabian Gulf League,19522,Al Dhafra SSC,Dibba,2.5,3.6,2.55
12-09-25,17:15,Ajman Club vs AL Bataeh (UAE),United Arab Emirates Arabian Gulf League,23417,Ajman Club,AL Bataeh (UAE),2.1,3.5,3.2
12-09-25,16:00,Ittihad Tanger vs Hassania Union Sport Agadir,Morocco Botola Pro D1,41717,Ittihad Tanger,Hassania Union Sport Agadir,2.4,2.7,3.6
12-09-25,18:00,Olympique Club de Safi vs Union Touarga,Morocco Botola Pro D1,41718,Olympique Club de Safi,Union Touarga,1.99,3.1,4.1
12-09-25,18:00,Olympique Dcheira vs Rs Berkane,Morocco Botola Pro D1,23307,Olympique Dcheira,Rs Berkane,5.6,3.25,1.72
12-09-25,20:00,Wydad AC vs Kawkab Athletic Club of Marrakech,Morocco Botola Pro D1,42145,Wydad AC,Kawkab Athletic Club of Marrakech,1.49,4.0,6.6
12-09-25,17:00,KS Lechia Gdansk vs GKS Katowice,Poland Ekstraklasa,30971,KS Lechia Gdansk,GKS Katowice,2.2,3.75,2.95
12-09-25,19:30,KKS Lech Poznan vs Zaglebie Lubin,Poland Ekstraklasa,11267,KKS Lech Poznan,Zaglebie Lubin,1.54,4.4,5.5
12-09-25,17:00,JK Tallinna Kalev vs FC Tallinn,Estonia Esiliiga,37895,JK Tallinna Kalev,FC Tallinn,2.45,3.9,2.25
12-09-25,11:00,FC Podillya Khmelnytskyi vs Probiy Gorodenka,Ukraine Persha Liga,25601,FC Podillya Khmelnytskyi,Probiy Gorodenka,2.35,3.1,2.6
12-09-25,19:45,Bohemians Dublin FC vs Derry City FC,Ireland Premier Division,41261,Bohemians Dublin FC,Derry City FC,2.2,3.1,3.5
12-09-25,19:00,Norwich City U21 vs Colchester United U21,England Amateur Premier League Cup,12862,Norwich City U21,Colchester United U21,1.36,5.3,6.4
12-09-25,19:00,Reading U21 vs Bournemouth U21,England Amateur Premier League Cup,14193,Reading U21,Bournemouth U21,3.7,5.2,1.63
12-09-25,18:15,Hercules de Alicante CF vs CF Algeciras,Spain Primera Federacion,24546,Hercules de Alicante CF,CF Algeciras,1.78,3.25,4.3
12-09-25,20:30,Barakaldo CF vs Arenas Club Getxo,Spain Primera Federacion,43443,Barakaldo CF,Arenas Club Getxo,2.05,3.1,3.5
12-09-25,15:00,FK Usce Novi Beograd vs FK Fap,Serbia Prva Liga,12460,FK Usce Novi Beograd,FK Fap,2.2,2.8,3.2
12-09-25,15:00,OFK Vrsac vs Gfk Dubocica,Serbia Prva Liga,45156,OFK Vrsac,Gfk Dubocica,1.83,3.0,4.0
12-09-25,17:00,GKS Tychy vs KS Polonia Bytom SA,Poland 1. Liga,35773,GKS Tychy,KS Polonia Bytom SA,2.3,3.4,2.85
12-09-25,19:30,Chrobry Glogow vs Pogon Siedlce,Poland 1. Liga,35837,Chrobry Glogow,Pogon Siedlce,2.2,3.25,3.1
12-09-25,15:00,Skanstes SK vs Riga FC II,Latvia 1.Liga,37634,Skanstes SK,Riga FC II,1.45,4.3,5.6
12-09-25,17:00,Austria Lustenau vs SK Sturm Graz II,Austria 2. Liga,36860,Austria Lustenau,SK Sturm Graz II,1.56,4.4,5.0
12-09-25,17:00,Kapfenberger SV vs FC Hertha Wels,Austria 2. Liga,37625,Kapfenberger SV,FC Hertha Wels,1.99,3.9,3.2
12-09-25,17:00,SKN St Polten vs SV Stripfing,Austria 2. Liga,37306,SKN St Polten,SV Stripfing,1.56,4.3,5.1
12-09-25,17:00,SKU Amstetten vs Rapid Wien II,Austria 2. Liga,37923,SKU Amstetten,Rapid Wien II,1.53,4.4,5.2
12-09-25,19:30,FAC Wien vs SK Austria Klagenfurt,Austria 2. Liga,38119,FAC Wien,SK Austria Klagenfurt,2.2,3.4,3.1
12-09-25,13:00,FC Bekasi City vs Psps Pekanbaru,Indonesia Championship,23358,FC Bekasi City,Psps Pekanbaru,2.35,3.0,2.9
12-09-25,18:30,Sollentuna FK vs FC Arlanda,"Sweden Ettan, Norra",25906,Sollentuna FK,FC Arlanda,2.7,3.7,2.3
12-09-25,18:00,Skovde AIK vs FC Trollhattan,"Sweden Ettan, Sodra",16738,Skovde AIK,FC Trollhattan,2.8,3.6,2.25
12-09-25,17:00,1.SK Prostejov vs SK Hanacka Slavia Kromeriz,Czechia FNL,33181,1.SK Prostejov,SK Hanacka Slavia Kromeriz,1.81,3.75,3.8
12-09-25,17:00,FC Vysocina Jihlava vs SK Slavia Prague B,Czechia FNL,32405,FC Vysocina Jihlava,SK Slavia Prague B,2.15,3.6,3.0
12-09-25,17:00,FK Pribram vs FC Vlasim,Czechia FNL,33492,FK Pribram,FC Vlasim,2.35,3.7,2.6
12-09-25,17:00,SK Dynamo Ceske Budejovice vs FC Silon Taborsko,Czechia FNL,33355,SK Dynamo Ceske Budejovice,FC Silon Taborsko,2.9,3.5,2.25
12-09-25,20:00,Varzim SC vs Uniao SC Paredes,Portugal Liga Portugal 3,14018,Varzim SC,Uniao SC Paredes,2.25,3.1,3.0
12-09-25,12:30,Geylang International FC vs Albirex Niigata Singapore FC,Singapore Premier League,27031,Geylang International FC,Albirex Niigata Singapore FC,1.8,4.5,3.3
12-09-25,19:45,Glentoran FC vs Linfield FC,Northern Ireland Premiership,26538,Glentoran FC,Linfield FC,3.0,3.25,2.3
12-09-25,21:00,UD Villa Santa Brigida vs UD Las Palmas C,"Spain Amateur Tercera Federacion, Group 12",21553,UD Villa Santa Brigida,UD Las Palmas C,2.5,2.95,2.75
12-09-25,18:30,Pena Sport FC vs CD Pamplona,"Spain Amateur Tercera Federacion, Group 15",23153,Pena Sport FC,CD Pamplona,1.72,3.4,4.4
12-09-25,19:00,CD Huarte vs FC Bidezarra,"Spain Amateur Tercera Federacion, Group 15",43704,CD Huarte,FC Bidezarra,1.66,3.4,4.9
12-09-25,16:30,Ekenas Idrottsforening vs SalPa,Finland Ykkosliiga,29043,Ekenas Idrottsforening,SalPa,1.42,4.9,6.1
12-09-25,16:30,PK-35 Helsinki vs KaPa Kapylan Pallo,Finland Ykkosliiga,28913,PK-35 Helsinki,KaPa Kapylan Pallo,1.83,4.0,3.6
12-09-25,17:00,Torpedo Moscow vs FC Volga Ulyanovsk,Russia 1. Liga,16218,Torpedo Moscow,FC Volga Ulyanovsk,1.72,3.6,4.8
12-09-25,16:00,FK Pohronie Ziar Nad Hronom Dolna Zdana vs FC Petrzalka,Slovakia 2. Liga,41139,FK Pohronie Ziar Nad Hronom Dolna Zdana,FC Petrzalka,2.2,3.5,2.8
12-09-25,18:30,IF Haga vs Vanersborgs FK,"Sweden Division 2, Norra Gotaland",40775,IF Haga,Vanersborgs FK,2.25,3.6,2.7
12-09-25,18:00,IK Franke vs FC Jarfalla,"Sweden Division 2, Norra Svealand",40770,IK Franke,FC Jarfalla,3.75,3.8,1.75
12-09-25,18:00,Kristianstad FC vs IFK Karlshamn,"Sweden Division 2, Sodra Gotaland",41114,Kristianstad FC,IFK Karlshamn,1.34,4.8,6.8
12-09-25,18:00,Linero IF vs FBK Balkan,"Sweden Division 2, Sodra Gotaland",29882,Linero IF,FBK Balkan,1.74,3.75,3.9
12-09-25,18:00,Rappe GOIF vs Nosaby IF,"Sweden Division 2, Sodra Gotaland",25496,Rappe GOIF,Nosaby IF,1.8,3.7,3.6
12-09-25,18:15,IFK Hassleholm vs Solvesborgs GoIF,"Sweden Division 2, Sodra Gotaland",44037,IFK Hassleholm,Solvesborgs GoIF,2.85,3.75,2.1
12-09-25,18:00,Landvetter IS vs Tvaakers IF,"Sweden Division 2, Vastra Gotaland",39433,Landvetter IS,Tvaakers IF,4.0,4.2,1.63
12-09-25,18:30,IF Boljan Falkenberg vs Lindome GIF,"Sweden Division 2, Vastra Gotaland",33025,IF Boljan Falkenberg,Lindome GIF,4.25,4.3,1.59
12-09-25,20:30,CA Tembetary Ypane vs Sportivo Ameliano,"Paraguay Division de Honor, Clausura",36373,CA Tembetary Ypane,Sportivo Ameliano,3.5,3.1,2.1
12-09-25,23:00,CS 2 de Mayo vs Club Guarani Asuncion,"Paraguay Division de Honor, Clausura",28790,CS 2 de Mayo,Club Guarani Asuncion,2.95,3.1,2.35
12-09-25,15:00,Sokol Kleczew vs Podhale Nowy Targ,Poland II Liga,28812,Sokol Kleczew,Podhale Nowy Targ,2.75,3.6,2.3
12-09-25,16:00,LKS Lodz II vs Olimpia Grudziadz,Poland II Liga,16950,LKS Lodz II,Olimpia Grudziadz,3.9,3.5,1.84
12-09-25,17:00,Unia Skierniewice vs KS Hutnik Krakow SSA,Poland II Liga,20673,Unia Skierniewice,KS Hutnik Krakow SSA,1.83,3.75,3.75
12-09-25,15:30,Zabkovia Zabki vs LKS 1926 Lomza,"Poland III Liga, Group 1",24689,Zabkovia Zabki,LKS 1926 Lomza,2.4,3.75,2.4
12-09-25,18:26,Lechia Tomaszow Mazowiecki vs Bron Radom,"Poland III Liga, Group 1",21765,Lechia Tomaszow Mazowiecki,Bron Radom,1.95,3.7,3.1
12-09-25,16:00,MKS Notec Czarnkow vs MKS Viktoria Wrzesnia,"Poland III Liga, Group 2",24421,MKS Notec Czarnkow,MKS Viktoria Wrzesnia,1.67,3.9,4.2
12-09-25,17:00,Zawisza Bydgoszcz vs Pogon Nowe Skalmierzyce,"Poland III Liga, Group 2",25106,Zawisza Bydgoszcz,Pogon Nowe Skalmierzyce,1.41,4.75,5.5
12-09-25,18:00,Polonia Sroda Wielkopolska vs KS Lipno Steszew,"Poland III Liga, Group 2",39011,Polonia Sroda Wielkopolska,KS Lipno Steszew,1.51,4.3,4.8
12-09-25,17:00,Karkonosze Jelenia Gora vs Zaglebie Lubin II,"Poland III Liga, Group 3",24452,Karkonosze Jelenia Gora,Zaglebie Lubin II,2.55,3.7,2.25
12-09-25,18:00,KS Polonia Nysa vs MKS Stal Jasien,"Poland III Liga, Group 3",35334,KS Polonia Nysa,MKS Stal Jasien,1.67,3.8,4.1
12-09-25,19:30,Kilbarrack United vs Killester Donnycarney F.C,"Ireland Leinster Senior League, Senior Division",39195,Kilbarrack United,Killester Donnycarney F.C,2.0,3.6,3.1
12-09-25,19:45,St. Mochtas vs Wayside Celtic,"Ireland Leinster Senior League, Senior Division",43747,St. Mochtas,Wayside Celtic,1.43,4.5,5.6
12-09-25,20:00,St. Francis FC vs Ballymun United,"Ireland Leinster Senior League, Senior Division",43751,St. Francis FC,Ballymun United,1.74,4.0,3.6
12-09-25,16:00,CSM Ceahlaul Piatra Neamt vs FC Bihor Oradea,Romania Liga 2,29327,CSM Ceahlaul Piatra Neamt,FC Bihor Oradea,2.95,3.2,2.25
12-09-25,14:00,Gandzasar Kapan FC vs FC Van Charentsavan,Armenia Premier League,41314,Gandzasar Kapan FC,FC Van Charentsavan,3.33,3.33,2.05
12-09-25,16:00,FC Shirak Gyumri vs Ararat Yerevan FC,Armenia Premier League,41670,FC Shirak Gyumri,Ararat Yerevan FC,2.25,3.4,2.95
12-09-25,00:00,Dynamo Puerto FC vs CS Maritimo de la Guaira,Venezuela Segunda Division,10926,Dynamo Puerto FC,CS Maritimo de la Guaira,2.35,3.1,2.85
12-09-25,16:00,Al Shahaniya vs Al Sadd SC,Qatar Stars League,39531,Al Shahaniya,Al Sadd SC,12.5,7.3,1.17
12-09-25,18:00,Al Duhail SC vs Umm-Salal SC,Qatar Stars League,31312,Al Duhail SC,Umm-Salal SC,1.41,5.2,6.0
12-09-25,18:00,Al Gharafa SC vs Al-Sailiya SC,Qatar Stars League,18199,Al Gharafa SC,Al-Sailiya SC,1.43,4.9,6.1
12-09-25,18:15,FK Arsenal Dzerzhinsk vs FC Slavia Mozyr,Belarus Vysshaya Liga,37890,FK Arsenal Dzerzhinsk,FC Slavia Mozyr,4.0,3.3,1.94
12-09-25,14:30,Shkendija Tetovo vs Bashkimi Kumanovo,North Macedonia 1. MFL,45319,Shkendija Tetovo,Bashkimi Kumanovo,1.37,4.4,7.0
12-09-25,18:00,FK Vardar Skopje vs FK Makedonija Gjorce Petrov,North Macedonia 1. MFL,45320,FK Vardar Skopje,FK Makedonija Gjorce Petrov,1.38,4.2,7.4
12-09-25,19:00,NK Rudar Velenje vs Triglav Kranj,Slovenia 2. Liga,39306,NK Rudar Velenje,Triglav Kranj,3.8,3.6,1.77
12-09-25,19:15,Krka Novo Mesto vs NK Brinje Grosuplje,Slovenia 2. Liga,28420,Krka Novo Mesto,NK Brinje Grosuplje,6.3,4.4,1.4
12-09-25,18:00,Jahn Regensburg vs Rot-Weiss Essen,Germany 3. Liga,34203,Jahn Regensburg,Rot-Weiss Essen,3.2,3.6,2.15
12-09-25,10:00,Shimshon Tel Aviv vs Sport Club Dimona,Israel Liga Alef,26452,Shimshon Tel Aviv,Sport Club Dimona,2.6,3.1,2.7
12-09-25,10:15,FC Jerusalem vs FC Beitar Yavne,Israel Liga Alef,37366,FC Jerusalem,FC Beitar Yavne,1.71,3.9,4.2
12-09-25,11:40,Maccabi Y. vs AS Nordia Jerusalem,Israel Liga Alef,43826,Maccabi Y.,AS Nordia Jerusalem,2.05,3.5,3.3
12-09-25,11:45,FC Kfar Saba vs Maccabi Ironi Ashdod FC,Israel Liga Alef,37462,FC Kfar Saba,Maccabi Ironi Ashdod FC,2.45,3.2,2.8
12-09-25,11:50,Hapoel Karmiel FC vs Hapoel Beit Shean Mesilot,Israel Liga Alef,37470,Hapoel Karmiel FC,Hapoel Beit Shean Mesilot,1.7,3.75,4.4
12-09-25,12:00,Baqa Al-Gharbiyye vs Maccabi Kiryat Ata-Bialik,Israel Liga Alef,37569,Baqa Al-Gharbiyye,Maccabi Kiryat Ata-Bialik,2.2,3.3,3.1
12-09-25,12:00,Maccabi Achi Nazareth FC vs Hapoel Tirat Hacarmel,Israel Liga Alef,28705,Maccabi Achi Nazareth FC,Hapoel Tirat Hacarmel,2.0,3.3,3.6
12-09-25,12:00,Tzeirey Um El Fahem vs MS Tira,Israel Liga Alef,37896,Tzeirey Um El Fahem,MS Tira,2.35,3.25,2.85
12-09-25,12:15,FC Tzeirey Tira vs Maccabi Ironi Kiryat Malakhi,Israel Liga Alef,37643,FC Tzeirey Tira,Maccabi Ironi Kiryat Malakhi,3.6,3.2,2.05
12-09-25,12:40,Maccabi Nujeidat Ahmad vs Hapoel Migdal Haemeq,Israel Liga Alef,45214,Maccabi Nujeidat Ahmad,Hapoel Migdal Haemeq,5.7,4.1,1.51
12-09-25,12:45,Maccabi Ironi Kiryat Gat vs FC Holon Yirmiyahu,Israel Liga Alef,37725,Maccabi Ironi Kiryat Gat,FC Holon Yirmiyahu,2.1,3.3,3.4
12-09-25,22:00,AD Carmelita vs Futbol Consultants Desamparados,"Costa Rica Liga de Ascenso, Apertura",26204,AD Carmelita,Futbol Consultants Desamparados,2.3,3.4,2.85
12-09-25,22:00,Deportivo Mixco vs CD Marquense,Guatemala Liga Nacional. Apertura,11499,Deportivo Mixco,CD Marquense,1.28,5.0,10.5
12-09-25,22:00,San Francisco FC B vs CD Bocas FC,Panama Liga Prom,11097,San Francisco FC B,CD Bocas FC,2.3,3.5,2.6
12-09-25,14:30,FC Belshina Bobruisk vs FC Lida,Belarus Pervaya Liga,45298,FC Belshina Bobruisk,FC Lida,1.95,3.2,4.0
12-09-25,20:00,FK Radnik Bijeljina vs FK Sloga Doboj,Bosnia & Herzegovina Premijer Liga,35076,FK Radnik Bijeljina,FK Sloga Doboj,1.9,3.33,3.9
12-09-25,15:30,NK Rudes Zagreb vs NK Dubrava Zagreb,Croatia Prva NL,14538,NK Rudes Zagreb,NK Dubrava Zagreb,1.78,3.25,4.4
12-09-25,11:00,K. Khanh Hoa vs Hoa Binh FC,Vietnam Vietnam Cup,21106,K. Khanh Hoa,Hoa Binh FC,2.15,2.9,3.5
12-09-25,17:00,Doxa Katokopias vs Nea Salamina Famagusta,Cyprus 2nd Division,18222,Doxa Katokopias,Nea Salamina Famagusta,3.0,3.25,2.0
12-09-25,17:00,M E A P Nisou vs PAEEK Kyrenia,Cyprus 2nd Division,18714,M E A P Nisou,PAEEK Kyrenia,2.65,3.25,2.25
12-09-25,17:00,FK Suduva Marijampole vs FK Panevezys,Lithuania A Lyga,44311,FK Suduva Marijampole,FK Panevezys,1.92,3.5,3.7
12-09-25,18:00,Dziugas vs Dfk Dainava Alytus,Lithuania A Lyga,44312,Dziugas,Dfk Dainava Alytus,1.7,3.6,4.7
12-09-25,18:00,JK Tabasalu vs Maardu Linnameeskond,Estonia Esiliiga B,16197,JK Tabasalu,Maardu Linnameeskond,9.8,7.2,1.16
12-09-25,19:30,Deportivo Santani vs Resistencia SC,Paraguay Segunda Division,40791,Deportivo Santani,Resistencia SC,2.1,3.3,3.1
12-09-25,23:00,Sportivo San Lorenzo vs Tacuary Asuncion,Paraguay Segunda Division,44888,Sportivo San Lorenzo,Tacuary Asuncion,2.05,3.25,3.25
12-09-25,13:00,Buriram United vs Prachuap FC,Thailand Thai League 1,36587,Buriram United,Prachuap FC,1.17,7.4,13.0
12-09-25,13:00,Uthai Thani FC vs BG Pathum United,Thailand Thai League 1,37029,Uthai Thani FC,BG Pathum United,3.0,3.6,2.15
12-09-25,13:00,Mahasarakham United FC vs Phrae United,Thailand Thai League 2,13751,Mahasarakham United FC,Phrae United,2.05,3.7,2.9
12-09-25,16:00,FK Ekranas vs FK Transinvest,Lithuania 1 Lyga,40912,FK Ekranas,FK Transinvest,11.5,6.3,1.17
12-09-25,16:00,Kedainiai Nevezis vs FK Babrungas Plunge,Lithuania 1 Lyga,34756,Kedainiai Nevezis,FK Babrungas Plunge,3.9,4.1,1.67
12-09-25,17:00,Hegelmann Litauen B vs FA Siauliai B,Lithuania 1 Lyga,33359,Hegelmann Litauen B,FA Siauliai B,1.98,4.0,2.9
12-09-25,18:00,Baltijos Futbolo Akademija vs Vilnius FK Zalgiris B,Lithuania 1 Lyga,42448,Baltijos Futbolo Akademija,Vilnius FK Zalgiris B,1.68,3.8,4.1
12-09-25,20:00,FC Universitario de Vinto vs CD Real Tomayapo,Bolivia Division Profesional,20772,FC Universitario de Vinto,CD Real Tomayapo,1.76,3.75,4.1
12-09-25,18:00,FC Tatabanya vs Soroksar SC,Hungary Magyar Kupa,20467,FC Tatabanya,Soroksar SC,3.9,3.8,1.78
12-09-25,12:00,Club Atletico Tembetary Reserves vs Sportivo Ameliano Reserves,"Paraguay Primera Division Reserve, Clausura",43928,Club Atletico Tembetary Reserves,Sportivo Ameliano Reserves,3.4,3.2,2.05
12-09-25,15:00,Al-Khaldiya SC vs Aali,Bahrain Premier League,41545,Al-Khaldiya SC,Aali,1.32,5.1,8.1
12-09-25,15:00,Al-Muharraq SC vs Al-Ahli SC Manama,Bahrain Premier League,41462,Al-Muharraq SC,Al-Ahli SC Manama,1.58,3.6,6.0
12-09-25,23:30,Uniao Sao Joao EC SP vs EC Primavera SP,Brazil Copa Paulista,45152,Uniao Sao Joao EC SP,EC Primavera SP,2.45,3.5,2.6
12-09-25,16:00,Ben Aknoun vs Paradou AC,Algeria Ligue 1,26896,Ben Aknoun,Paradou AC,2.25,2.95,3.4
12-09-25,16:00,Olympique Akbou vs MC Alger,Algeria Ligue 1,42060,Olympique Akbou,MC Alger,3.4,2.6,2.45
12-09-25,19:00,MC Oran vs JS Kabylie,Algeria Ligue 1,35417,MC Oran,JS Kabylie,2.35,2.85,3.3
12-09-25,20:00,Hearts of Oak vs Hohoe United FC,Ghana Premier League,43252,Hearts of Oak,Hohoe United FC,1.39,3.8,8.6
12-09-25,19:45,Cobh Ramblers vs Treaty United,Ireland First Division,38150,Cobh Ramblers,Treaty United,1.41,4.6,6.5
12-09-25,19:45,Dundalk FC vs Bray Wanderers AFC,Ireland First Division,38279,Dundalk FC,Bray Wanderers AFC,1.53,4.2,5.3
12-09-25,19:45,University College Dublin vs Longford Town FC,Ireland First Division,38570,University College Dublin,Longford Town FC,1.62,3.9,4.8
12-09-25,19:30,Calcio Foggia vs Latina Calcio,"Italy Serie C, Group C",17856,Calcio Foggia,Latina Calcio,2.2,3.1,3.25
12-09-25,19:30,Potenza Calcio vs Crotone,"Italy Serie C, Group C",17865,Potenza Calcio,Crotone,2.95,3.3,2.3
12-09-25,19:30,SS Monopoli vs Audace Cerignola,"Italy Serie C, Group C",39731,SS Monopoli,Audace Cerignola,2.7,3.2,2.55
12-09-25,17:00,Mochudi Centre Chiefs vs Santa Green FC,Botswana Premier League,43521,Mochudi Centre Chiefs,Santa Green FC,1.57,3.4,5.0
12-09-25,17:00,SC Villa vs Kampala Capital City Authority FC,Uganda Super 8,39766,SC Villa,Kampala Capital City Authority FC,2.6,2.95,2.45
12-09-25,14:00,Gorilla FC vs AS Muhanga,Rwanda Premier League,28595,Gorilla FC,AS Muhanga,1.92,2.95,3.7
12-09-25,16:00,AL Salt vs Al-Ahly Amman,Jordan Jordan League,25336,AL Salt,Al-Ahly Amman,1.95,3.33,3.75
12-09-25,18:30,AL Jazeera Club Amman vs Al Wehdat,Jordan Jordan League,25758,AL Jazeera Club Amman,Al Wehdat,4.9,3.8,1.63
12-09-25,18:00,FC Memmingen vs TSV Buchbach,Germany Amateur Regionalliga Bavaria,41367,FC Memmingen,TSV Buchbach,2.75,3.6,2.2
12-09-25,18:00,Hankofen-Hailing vs Bayern Munich II,Germany Amateur Regionalliga Bavaria,41421,Hankofen-Hailing,Bayern Munich II,6.4,4.8,1.36
12-09-25,18:00,SpVgg Ansbach vs FC Augsburg II,Germany Amateur Regionalliga Bavaria,41403,SpVgg Ansbach,FC Augsburg II,2.05,3.75,2.9
12-09-25,18:00,SpVgg Unterhaching vs TSV Aubstadt,Germany Amateur Regionalliga Bavaria,32030,SpVgg Unterhaching,TSV Aubstadt,1.56,4.0,4.75
12-09-25,18:00,Wacker Burghausen vs Viktoria Aschaffenburg,Germany Amateur Regionalliga Bavaria,41288,Wacker Burghausen,Viktoria Aschaffenburg,1.42,4.4,5.9
12-09-25,17:30,Atus Velden vs SK Treibach,Austria Amateur Regionalliga Centre,37936,Atus Velden,SK Treibach,1.6,4.0,3.9
12-09-25,18:00,Deutschlandsberger SC vs LASK Amateure OO,Austria Amateur Regionalliga Centre,39033,Deutschlandsberger SC,LASK Amateure OO,3.7,4.25,1.61
12-09-25,18:00,FC Gleisdorf 09 vs SV Lafnitz,Austria Amateur Regionalliga Centre,38016,FC Gleisdorf 09,SV Lafnitz,,,
12-09-25,18:00,SC Kalsdorf vs SV Ried II,Austria Amateur Regionalliga Centre,37986,SC Kalsdorf,SV Ried II,1.02,8.75,27.0
12-09-25,18:00,SPG Wallern/ASV St. Marienkirchen vs Wolfsberger AC (A),Austria Amateur Regionalliga Centre,27956,SPG Wallern/ASV St. Marienkirchen,Wolfsberger AC (A),2.35,3.5,2.35
12-09-25,18:30,Blau-Weiss Lohne vs VfB Oldenburg,Germany Amateur Regionalliga North,30704,Blau-Weiss Lohne,VfB Oldenburg,6.7,5.1,1.33
12-09-25,18:30,SC Weiche Flensburg 08 vs SV Drochtersen/Assel,Germany Amateur Regionalliga North,13463,SC Weiche Flensburg 08,SV Drochtersen/Assel,3.6,3.7,1.82
12-09-25,17:00,Hallescher FC vs BSG Chemie Leipzig,Germany Amateur Regionalliga Northeast,40693,Hallescher FC,BSG Chemie Leipzig,1.25,5.4,9.0
12-09-25,18:00,FC Magdeburg II vs Greifswalder FC,Germany Amateur Regionalliga Northeast,22045,FC Magdeburg II,Greifswalder FC,2.05,3.5,3.1
12-09-25,18:00,Hertha BSC II vs BFC Dynamo,Germany Amateur Regionalliga Northeast,28738,Hertha BSC II,BFC Dynamo,2.05,3.7,2.95
12-09-25,18:00,VSG Altglienicke vs FSV Zwickau,Germany Amateur Regionalliga Northeast,40818,VSG Altglienicke,FSV Zwickau,1.91,3.4,3.5
12-09-25,18:00,SC Neusiedl am See 1919 vs SV Donau,Austria Amateur Regionalliga Ost,42546,SC Neusiedl am See 1919,SV Donau,2.5,3.4,2.3
12-09-25,18:10,Favoritner AC vs SC/ESV Parndorf 1919,Austria Amateur Regionalliga Ost,42572,Favoritner AC,SC/ESV Parndorf 1919,4.0,3.9,1.6
12-09-25,18:30,Kremser SC vs Wiener Sport-Club,Austria Amateur Regionalliga Ost,42624,Kremser SC,Wiener Sport-Club,1.86,3.8,3.0
12-09-25,18:00,SG Sonnenhof Grossaspach vs Offenbacher FC Kickers 1901,Germany Amateur Regionalliga Southwest,37130,SG Sonnenhof Grossaspach,Offenbacher FC Kickers 1901,1.91,3.9,3.1
12-09-25,18:00,SC Schwaz vs SVG Reichenau,Austria Amateur Regionalliga West,39236,SC Schwaz,SVG Reichenau,,,
12-09-25,18:30,1. FC Bocholt vs Sportfreunde Siegen 1899,Germany Amateur Regionalliga West,27998,1. FC Bocholt,Sportfreunde Siegen 1899,2.05,3.6,2.95
12-09-25,18:30,VfL Sportfreunde Lotte 1929 vs SC Paderborn 07 II,Germany Amateur Regionalliga West,30374,VfL Sportfreunde Lotte 1929,SC Paderborn 07 II,1.66,3.9,4.2
12-09-25,18:30,SPVG Frechen 20 vs TUS BW Konigsdorf,Germany Amateur Mittelrheinliga,37151,SPVG Frechen 20,TUS BW Konigsdorf,2.25,3.9,2.5
12-09-25,18:30,Tura Harksheide vs Niendorfer TSV 1919,Germany Amateur Oberliga Hamburg,11223,Tura Harksheide,Niendorfer TSV 1919,3.1,4.5,1.81
