date,log_time,tournament,title,home-team,away-team,pre-match_odds_home,pre-match_odds_draw,pre-match_odds_away,home_ht_goals,away_ht_goals,ht_goals
07-09-25,18:54,Guatemala Primera Division,Deportivo Nueva Concepcion vs Huehuetecos FC,Deportivo Nueva Concepcion,Huehuetecos FC,1.5,3.5,6.8,1,0,1
07-09-25,18:54,,AL Arabi Doha U23 vs Umm Salal U23,AL Arabi Doha U23,Umm Salal U23,,,,0,0,0
07-09-25,18:54,Qatar U23 Olympic League,AL Rayyan U23 vs AL Duhail U23,AL Rayyan U23,AL Duhail U23,2.45,3.2,2.45,1,0,1
07-09-25,18:54,Qatar U23 Olympic League,AL Sadd U23 vs AL Gharafa U23,AL Sadd U23,AL Gharafa U23,2.45,3.2,2.45,0,0,0
07-09-25,19:16,Argentina Primera Nacional,Gimnasia Y Esgrima Mendoza vs Gimnasia y Esgrima de Jujuy,Gimnasia Y Esgrima Mendoza,Gimnasia y Esgrima de Jujuy,1.92,2.75,5.1,0,0,0
07-09-25,19:16,"Spain Amateur Tercera Federacion, Group 9",CF Motril vs CD Huetor Tajar,CF Motril,CD Huetor Tajar,1.75,3.2,4.7,1,0,1
07-09-25,19:16,"Costa Rica Primera Division, Women",Moravia vs Chorotega FC,Moravia,Chorotega FC,2.8,3.4,2.35,1,0,1
07-09-25,19:38,"Brazil Carioca, Serie B1",Campo Grande AC RJ vs Serrano FC RJ,Campo Grande AC RJ,Serrano FC RJ,3.1,2.8,2.4,0,1,1
07-09-25,19:50,Chile Primera Division,Cobresal vs CD Palestino,Cobresal,CD Palestino,2.55,3.33,2.6,1,0,1
07-09-25,19:50,Argentina Torneo Federal A,Costa Brava de General Pico vs Kimberley de Mar Del Plata,Costa Brava de General Pico,Kimberley de Mar Del Plata,1.79,3.1,5.0,0,0,0
07-09-25,19:50,Chile Primera B,CD Santa Cruz vs Deportes Magallanes,CD Santa Cruz,Deportes Magallanes,2.4,3.2,2.9,0,1,1
07-09-25,19:50,Serbia Prva Liga,FK Vozdovac Belgrade vs FK Tekstilac Odzaci,FK Vozdovac Belgrade,FK Tekstilac Odzaci,1.44,3.7,6.0,1,0,1
07-09-25,19:50,"Argentina Primera LPF, Reserves",Independiente Rivadavia de Mendoza Reserve vs CD Godoy Cruz,Independiente Rivadavia de Mendoza Reserve,CD Godoy Cruz,2.25,3.2,2.7,1,0,1
07-09-25,19:50,"Argentina Primera LPF, Reserves",San Lorenzo de Almagro Res. vs CA Huracan,San Lorenzo de Almagro Res.,CA Huracan,1.98,3.1,3.33,0,1,1
07-09-25,19:50,Croatia Prva NL,HNK Cibalia Vinkovci vs NK Opatija,HNK Cibalia Vinkovci,NK Opatija,2.25,3.0,3.0,0,1,1
07-09-25,19:50,Brazil Copa Paulista,Comercial FC SP vs Sao Jose EC SP,Comercial FC SP,Sao Jose EC SP,3.9,2.4,2.45,0,0,0
07-09-25,19:50,,Shabab AL Ordun vs AL Faisaly (Jor),Shabab AL Ordun,AL Faisaly (Jor),,,,0,0,0
07-09-25,19:50,,Camboriu FC SC vs CA Tubarao SC,Camboriu FC SC,CA Tubarao SC,,,,0,0,0
07-09-25,19:50,"Brazil Gaucho, Women",EC Juventude RS vs SC Internacional RS,EC Juventude RS,SC Internacional RS,5.3,3.9,1.46,0,0,0
07-09-25,19:50,Mexico Liga Premier Serie A,Montaneses FC vs Jaguares FC,Montaneses FC,Jaguares FC,1.98,3.4,3.33,0,0,0
07-09-25,19:50,"El Salvador Primera Division, Reserves, Apertura",CD Aguila U20 vs CD Cacahuatique U20,CD Aguila U20,CD Cacahuatique U20,1.65,4.6,3.6,0,1,1
07-09-25,19:59,,Colomba FC vs CD Chiantla,Colomba FC,CD Chiantla,,,,0,0,0
07-09-25,19:59,,Blumenau EC SC vs Joinville EC SC,Blumenau EC SC,Joinville EC SC,,,,1,0,1
07-09-25,19:59,"El Salvador Primera Division, Reserves, Apertura",CD Fuerte San Francisco U20 vs AD Isidro Metapan U20,CD Fuerte San Francisco U20,AD Isidro Metapan U20,2.7,3.5,2.3,1,0,1
07-09-25,19:59,,Union Espanola vs Universidad Catolica,Union Espanola,Universidad Catolica,,,,0,0,0
07-09-25,19:59,Chile Segunda Division,General Velasquez vs Puerto Montt,General Velasquez,Puerto Montt,4.75,3.5,1.65,0,0,0
07-09-25,20:17,"Italy Serie C, Group B",US Livorno 1915 vs Guidonia Montecelio 1937 FC,US Livorno 1915,Guidonia Montecelio 1937 FC,1.74,3.4,4.75,0,0,0
07-09-25,20:17,"Italy Serie C, Group C",Latina Calcio vs AZ Picerno,Latina Calcio,AZ Picerno,3.2,3.0,2.3,0,1,1
07-09-25,20:17,,Jacioba AC AL vs EC Guarany AL,Jacioba AC AL,EC Guarany AL,,,,1,0,1
07-09-25,20:17,"Italy Serie A Cup, Women",Fcf Como vs Genoa Women,Fcf Como,Genoa Women,1.52,4.25,4.8,1,0,1
07-09-25,20:26,Argentina Torneo Federal A,CA Bartolome Mitre vs Linqueno,CA Bartolome Mitre,Linqueno,1.96,3.1,4.0,1,0,1
07-09-25,20:26,Argentina Torneo Federal A,Sp. Belgrano de S. F. vs CA Sarmiento de la Banda,Sp. Belgrano de S. F.,CA Sarmiento de la Banda,1.84,3.1,4.8,0,0,0
07-09-25,20:26,Argentina Torneo Federal A,Sportivo General San Martin vs Gimnasia de Chivilcoy,Sportivo General San Martin,Gimnasia de Chivilcoy,1.73,3.25,5.1,1,0,1
07-09-25,20:26,Uruguay Segunda Division,CA Rentistas vs Tacuarembo FC,CA Rentistas,Tacuarembo FC,2.1,3.1,3.33,0,0,0
07-09-25,20:26,Argentina Primera C,Argentino de Rosario vs CA Atlas,Argentino de Rosario,CA Atlas,1.58,3.8,5.75,0,0,0
07-09-25,20:26,"Italy Serie C, Group B",Sambenedettese vs Forli FC,Sambenedettese,Forli FC,2.3,3.1,3.1,0,0,0
07-09-25,20:26,"Italy Serie C, Group C",Asd Team Altamura vs Cavese 1919,Asd Team Altamura,Cavese 1919,2.7,3.0,2.7,1,0,1
07-09-25,20:26,"Italy Serie C, Group C",Audace Cerignola vs SIRACUSA,Audace Cerignola,SIRACUSA,1.6,3.7,5.4,0,0,0
07-09-25,20:26,,Magallanes Women vs Deportes Temuco Women,Magallanes Women,Deportes Temuco Women,,,,0,0,0
07-09-25,20:26,"Brazil Goiano, 3. Divisao",Santa Helena GO vs Aparecida EC GO,Santa Helena GO,Aparecida EC GO,1.48,3.5,6.1,1,0,1
07-09-25,20:36,International World Cup Qualification UEFA,Luxembourg vs Slovakia,Luxembourg,Slovakia,5.1,3.4,1.78,0,0,0
07-09-25,20:45,Argentina Torneo Federal A,Sportivo Las Parejas vs Club Sportivo Ben Hur,Sportivo Las Parejas,Club Sportivo Ben Hur,1.79,3.25,4.6,1,0,1
07-09-25,20:54,"Colombia Primera A, Clausura",Envigado FC vs Aguilas Doradas Rionegro,Envigado FC,Aguilas Doradas Rionegro,2.95,2.9,2.6,0,1,1
07-09-25,20:54,Argentina Torneo Federal A,Huracan Las Heras vs CD Santamarina Tandil,Huracan Las Heras,CD Santamarina Tandil,2.1,2.95,3.8,0,1,1
07-09-25,20:54,,Deportes Naval de Talcahuano vs Quintero Unido FC,Deportes Naval de Talcahuano,Quintero Unido FC,,,,0,1,1
07-09-25,20:54,Guatemala Primera Division,CD Suchitepequez vs Deportivo Coatepeque,CD Suchitepequez,Deportivo Coatepeque,1.41,3.9,7.6,0,0,0
07-09-25,21:13,USA National Womens Soccer League,Chicago Red Stars vs Orlando Pride,Chicago Red Stars,Orlando Pride,3.8,3.6,1.78,0,0,0
07-09-25,21:29,Argentina Torneo Federal A,Sportivo Y Biblioteca Atenas vs Cipolletti,Sportivo Y Biblioteca Atenas,Cipolletti,2.4,2.8,3.25,0,0,0
07-09-25,21:29,Argentina Primera Nacional,Deportivo Madryn vs Club Atletico Los Andes,Deportivo Madryn,Club Atletico Los Andes,1.63,3.3,6.2,0,0,0
07-09-25,21:29,Venezuela Segunda Division,Monagas SC B vs Bolivar SC,Monagas SC B,Bolivar SC,2.95,3.4,2.1,1,0,1
07-09-25,21:29,Venezuela Segunda Division,Trujillanos FC vs Barquisimeto SC,Trujillanos FC,Barquisimeto SC,1.77,2.9,5.3,1,0,1
07-09-25,21:29,Brazil Brasileiro Serie C,Floresta EC CE vs SER Caxias do Sul,Floresta EC CE,SER Caxias do Sul,2.5,2.75,3.2,0,0,0
07-09-25,21:29,Bolivia Copa Division Profesional,CD Real Tomayapo vs Guabira Montero,CD Real Tomayapo,Guabira Montero,2.55,3.4,2.4,1,0,1
07-09-25,21:29,,Perez Zeledon vs LD Alajuelense,Perez Zeledon,LD Alajuelense,,,,0,1,1
07-09-25,21:50,Venezuela Segunda Division,Angostura FC vs Mineros de Guayana,Angostura FC,Mineros de Guayana,2.95,3.1,2.25,1,0,1
07-09-25,21:50,Jamaica Premier League,Treasure Beach FC vs Molynes,Treasure Beach FC,Molynes,2.15,3.33,3.1,0,0,0
07-09-25,21:50,Peru Liga Femenina,Club Alianza Lima vs CD Universidad Cesar Vallejo,Club Alianza Lima,CD Universidad Cesar Vallejo,1.01,13.5,55.0,0,0,0
07-09-25,22:00,Argentina Primera Nacional,Central Norte Salta vs Agropecuario Argentino,Central Norte Salta,Agropecuario Argentino,2.25,2.85,3.5,0,0,0
07-09-25,22:20,"Costa Rica Primera Division, Women",Dimas Escazu vs LD Alajuelense,Dimas Escazu,LD Alajuelense,4.7,4.3,1.58,0,0,0
07-09-25,22:32,Chile Primera B,Deportes Concepcion vs CD Cobreloa Calama,Deportes Concepcion,CD Cobreloa Calama,2.45,3.0,2.95,1,0,1
07-09-25,22:50,Argentina Primera Nacional,Racing de Cordoba vs CA Patronato Parana,Racing de Cordoba,CA Patronato Parana,2.2,2.85,3.6,0,0,0
07-09-25,22:50,"Panama Liga Panamena, Clausura",Herrera FC vs Tauro FC,Herrera FC,Tauro FC,4.0,2.95,1.96,1,0,1
07-09-25,22:50,Venezuela Segunda Division,CS Maritimo de la Guaira vs Deportivo Miranda,CS Maritimo de la Guaira,Deportivo Miranda,2.0,3.2,3.5,0,0,0
07-09-25,22:50,"El Salvador Primera Division, Apertura",CD Fuerte San Francisco Morazan vs AD Isidro Metapan,CD Fuerte San Francisco Morazan,AD Isidro Metapan,4.0,3.0,1.94,0,0,0
07-09-25,22:50,"El Salvador Primera Division, Apertura",Zacatecoluca FC vs Alianza FC San Salvador,Zacatecoluca FC,Alianza FC San Salvador,4.5,2.85,1.91,0,1,1
07-09-25,22:50,,Motagua Reserves vs CD Real Espana Reserves,Motagua Reserves,CD Real Espana Reserves,,,,1,0,1
07-09-25,22:50,Guatemala Primera Division,Deportivo San Pedro vs Juventud Copalera,Deportivo San Pedro,Juventud Copalera,1.26,5.0,9.5,1,0,1
07-09-25,22:59,"Colombia Primera A, Clausura",America de Cali vs AD Cali,America de Cali,AD Cali,1.7,3.33,5.4,0,0,0
07-09-25,22:59,Guatemala Liga Nacional. Apertura,Deportivo Achuapa vs CSD Xelaju MC,Deportivo Achuapa,CSD Xelaju MC,2.5,2.8,3.1,1,0,1
07-09-25,22:59,,Club America Salcaja vs Barillas FC,Club America Salcaja,Barillas FC,,,,1,0,1
07-09-25,22:59,USA National Womens Soccer League,Gotham FC vs Angel City FC,Gotham FC,Angel City FC,1.67,3.5,4.6,0,1,1
07-09-25,22:59,Honduras Liga de Ascenso,Meluca FC vs CD Hondupino,Meluca FC,CD Hondupino,2.9,3.6,2.2,0,0,0
07-09-25,22:59,Guatemala Primera Division,Deportivo Carcha vs San Benito FC,Deportivo Carcha,San Benito FC,2.45,3.3,2.6,0,0,0
07-09-25,23:22,"Paraguay Primera Division Reserve, Apertura",Club 2 de Mayo Reserves vs Olimpia Asuncion Reserves,Club 2 de Mayo Reserves,Olimpia Asuncion Reserves,3.9,3.6,1.77,0,0,0
07-09-25,23:22,,Marathon Reserves vs Olimpia Reserves,Marathon Reserves,Olimpia Reserves,,,,0,0,0
07-09-25,23:53,Colombia Primera B,Real Cartagena FC vs Barranquilla FC,Real Cartagena FC,Barranquilla FC,1.29,5.1,9.0,0,0,0
07-09-25,23:53,Argentina Primera Nacional,CA Chaco For Ever vs Chacarita Juniors,CA Chaco For Ever,Chacarita Juniors,2.05,2.8,4.25,0,0,0
07-09-25,23:53,Brazil Brasileiro Serie C,Brusque FC SC vs Nautico PE,Brusque FC SC,Nautico PE,2.45,2.85,3.1,0,1,1
07-09-25,23:53,Brazil Brasileiro Serie D,America FC RN vs Santa Cruz FC PE,America FC RN,Santa Cruz FC PE,1.92,3.25,4.0,0,0,0
07-09-25,23:53,Mexico Liga Premier Serie A,Acatlan FC vs Tecos FC,Acatlan FC,Tecos FC,2.3,3.5,2.65,0,0,0
08-09-25,08:24,India Mizoram Premier League,Chanmari FC vs Mls FC Lawtngtlai,Chanmari FC,Mls FC Lawtngtlai,1.11,7.5,14.5,1,0,1
08-09-25,08:50,Simulated Reality League World Cup Qualifiers SRL,Belarus SRL vs Scotland SRL,Belarus SRL,Scotland SRL,6.69,4.0,1.54,0,0,0
08-09-25,08:50,Simulated Reality League World Cup Qualifiers SRL,Gibraltar SRL vs Faroe Islands SRL,Gibraltar SRL,Faroe Islands SRL,7.45,3.93,1.51,0,0,0
08-09-25,08:50,Simulated Reality League World Cup Qualifiers SRL,Greece SRL vs Denmark SRL,Greece SRL,Denmark SRL,2.4,3.19,3.12,1,0,1
08-09-25,09:52,Simulated Reality League World Cup Qualifiers SRL,Croatia SRL vs Montenegro SRL,Croatia SRL,Montenegro SRL,1.21,6.56,14.33,1,0,1
08-09-25,09:52,Simulated Reality League World Cup Qualifiers SRL,Israel SRL vs Italy SRL,Israel SRL,Italy SRL,7.19,4.73,1.43,0,0,0
08-09-25,09:52,Simulated Reality League World Cup Qualifiers SRL,Switzerland SRL vs Slovenia SRL,Switzerland SRL,Slovenia SRL,1.53,4.33,6.04,1,0,1
08-09-25,10:47,,Rakhine United FC U21 vs Thitsar Arman FC U21,Rakhine United FC U21,Thitsar Arman FC U21,,,,1,0,1
08-09-25,10:47,,Albania vs Kosovo,Albania,Kosovo,,,,0,0,0
08-09-25,10:58,,Thai Nguyen Women vs Ha Noi I Watabe Women,Thai Nguyen Women,Ha Noi I Watabe Women,,,,0,0,0
08-09-25,10:58,,Kachin United FC vs Myawady FC,Kachin United FC,Myawady FC,,,,0,1,1
08-09-25,11:24,India Mizoram Premier League,Aizawl FC vs Kanan FC Aizawl,Aizawl FC,Kanan FC Aizawl,1.18,6.2,11.0,1,0,1
08-09-25,11:42,,Adamas United Sa vs Kms Milan Bithee,Adamas United Sa,Kms Milan Bithee,,,,0,0,0
08-09-25,11:51,Republic of Korea WK-League,Incheon Hyundai Steel Red Angels vs Seoul City WFC,Incheon Hyundai Steel Red Angels,Seoul City WFC,2.2,3.25,2.7,0,1,1
08-09-25,11:51,Republic of Korea WK-League,Sejong Sportstoto WFC vs Changnyeong WFC,Sejong Sportstoto WFC,Changnyeong WFC,1.13,5.9,13.0,0,1,1
08-09-25,11:51,Republic of Korea WK-League,Suwon WFC vs Boeun Sangmu Wfc,Suwon WFC,Boeun Sangmu Wfc,2.4,3.33,2.4,0,1,1
08-09-25,11:51,,Rayon Sport Women vs Top Girls Academy Women,Rayon Sport Women,Top Girls Academy Women,,,,0,0,0
08-09-25,12:21,,FC Oleksandriya 2 vs FC Chernomorets-2 Odessa,FC Oleksandriya 2,FC Chernomorets-2 Odessa,,,,0,0,0
08-09-25,12:51,"Paraguay Primera Division Reserve, Clausura",Nacional Asuncion vs Deportivo Recoleta Reserve,Nacional Asuncion,Deportivo Recoleta Reserve,2.0,3.5,3.2,0,0,0
08-09-25,12:51,"Paraguay Primera Division Reserve, Clausura",Sportivo Luqueno vs Guarani Asuncion,Sportivo Luqueno,Guarani Asuncion,2.7,3.25,2.35,0,1,1
08-09-25,12:51,,Belarus vs Russia,Belarus,Russia,,,,1,0,1
08-09-25,13:56,"Uruguay Tercera Division, Reserves",Albion FC Reserves vs Juventud de Las Piedras Reserves,Albion FC Reserves,Juventud de Las Piedras Reserves,4.75,3.75,1.61,0,1,1
08-09-25,13:56,,Slovenia vs Faroe Islands,Slovenia,Faroe Islands,,,,0,0,0
08-09-25,13:56,,India vs Oman,India,Oman,,,,0,0,0
08-09-25,14:46,,Landskrona BoIS vs Mjallby AIF,Landskrona BoIS,Mjallby AIF,,,,0,0,0
08-09-25,14:58,"International World Cup, Qualification CAF",Equatorial Guinea vs Tunisia,Equatorial Guinea,Tunisia,3.6,3.1,2.15,0,0,0
08-09-25,14:58,"International World Cup, Qualification CAF",Mozambique vs Botswana,Mozambique,Botswana,1.78,3.33,5.0,1,0,1
08-09-25,14:58,"International World Cup, Qualification CAF",Zambia vs Morocco,Zambia,Morocco,5.6,4.0,1.58,0,1,1
08-09-25,14:58,International Int. Friendly Games,Malaysia vs Palestine,Malaysia,Palestine,2.85,3.3,2.45,1,0,1
08-09-25,14:58,,Bumamuru FC vs Mlandege FC,Bumamuru FC,Mlandege FC,,,,0,1,1
08-09-25,14:58,,San Martin Burzaco U20 vs Berazategui U20,San Martin Burzaco U20,Berazategui U20,,,,0,0,0
08-09-25,14:58,,Edfu Center vs El Qusiya SC,Edfu Center,El Qusiya SC,,,,1,0,1
08-09-25,14:58,Egypt Egypt Second Division B,Luxor vs Nasr Taadeen,Luxor,Nasr Taadeen,2.65,2.95,2.6,1,0,1
08-09-25,14:58,Egypt Egypt Second Division B,Tel Bani Swaif vs Fayoum FC,Tel Bani Swaif,Fayoum FC,2.1,2.95,3.5,0,0,0
08-09-25,14:58,,El Alameen vs Sila SC,El Alameen,Sila SC,,,,0,0,0
08-09-25,14:58,Egypt Egypt Second Division B,Misr Elmaqasah vs Team FC,Misr Elmaqasah,Team FC,2.4,2.95,2.9,0,1,1
08-09-25,15:24,International Int. Friendly Games,Indonesia vs Lebanon,Indonesia,Lebanon,1.72,3.8,4.6,0,0,0
08-09-25,15:53,Russia 1. Liga,FC Chelyabinsk vs Chayka Peschanokopskoye,FC Chelyabinsk,Chayka Peschanokopskoye,1.36,4.5,9.1,0,0,0
08-09-25,15:53,North Macedonia 2. MFL,Bregalnica Stip vs FK Teteks 1953,Bregalnica Stip,FK Teteks 1953,1.45,4.0,6.3,1,0,1
08-09-25,15:53,"Argentina Primera Division, Women",Rosario Central vs CA Banfield,Rosario Central,CA Banfield,3.7,3.1,1.96,0,1,1
08-09-25,16:10,"Argentina Primera Division, Women",Velez Sarfield vs Racing Club,Velez Sarfield,Racing Club,4.4,3.6,1.69,0,0,0
08-09-25,16:33,,IR Iran vs Uzbekistan,IR Iran,Uzbekistan,,,,0,0,0
08-09-25,16:53,,AL Salt vs AL Jazeera Club Amman,AL Salt,AL Jazeera Club Amman,,,,0,0,0
08-09-25,17:54,"International World Cup, Qualification CAF",Guinea vs Algeria,Guinea,Algeria,4.6,3.2,1.88,0,0,0
08-09-25,17:54,"International World Cup, Qualification CAF",Guinea-Bissau vs Djibouti,Guinea-Bissau,Djibouti,1.07,10.0,33.0,0,0,0
08-09-25,17:54,"International World Cup, Qualification CAF",Madagascar vs Chad,Madagascar,Chad,1.29,5.0,11.5,0,1,1
08-09-25,17:54,"International World Cup, Qualification CAF",Malawi vs Liberia,Malawi,Liberia,2.15,3.1,3.7,0,1,1
08-09-25,17:54,"International Youth U21 UEFA European Championship, Qualification",Estonia vs Iceland,Estonia,Iceland,5.1,4.2,1.55,1,0,1
08-09-25,17:54,Argentina Primera Nacional,Arsenal de Sarandi vs CSD Tristan Suarez,Arsenal de Sarandi,CSD Tristan Suarez,2.2,2.95,3.5,0,0,0
08-09-25,17:54,"Uruguay Tercera Division, Reserves",Defensor Sporting Reserves vs Club Atletico Penarol Reserves,Defensor Sporting Reserves,Club Atletico Penarol Reserves,2.5,3.25,2.55,0,0,0
08-09-25,18:31,International Int. Friendly Games,United Arab Emirates vs Bahrain,United Arab Emirates,Bahrain,1.8,3.6,4.3,1,0,1
08-09-25,18:31,International Youth U21 Friendly Games,Switzerland vs Albania,Switzerland,Albania,1.43,4.6,6.0,1,0,1
08-09-25,18:52,Qatar U23 Olympic League,AL Sailiya U23 vs AL Shamal U23,AL Sailiya U23,AL Shamal U23,1.84,3.5,3.33,0,1,1
08-09-25,18:52,,AL Shahaniya SC vs AL Wakrah SC U23,AL Shahaniya SC,AL Wakrah SC U23,,,,0,1,1
08-09-25,18:52,Qatar U23 Olympic League,Qatar SC U23 vs AL Ahli Doha U23,Qatar SC U23,AL Ahli Doha U23,1.98,3.25,3.2,0,1,1
08-09-25,19:14,International Int. Friendly Games,Czechia vs Saudi Arabia,Czechia,Saudi Arabia,1.47,4.4,6.7,1,0,1
08-09-25,19:52,Chile Primera B,Deportes Recoleta vs San Marcos de Arica,Deportes Recoleta,San Marcos de Arica,2.05,3.3,3.5,0,0,0
08-09-25,19:52,England Amateur Premier League Cup,Bromley FC U21 vs Sunderland U21,Bromley FC U21,Sunderland U21,9.2,6.9,1.21,1,0,1
08-09-25,19:52,Argentina Primera Nacional,CA Alvarado vs CD Maipu,CA Alvarado,CD Maipu,2.65,2.75,2.95,0,0,0
08-09-25,19:52,"Uruguay Tercera Division, Reserves",Atletico River Plate Reserves vs Danubio Reserves,Atletico River Plate Reserves,Danubio Reserves,4.0,3.4,1.79,1,0,1
08-09-25,19:52,"Uruguay Tercera Division, Reserves",Club Oriental de La Paz Reserves vs Progreso Reserves,Club Oriental de La Paz Reserves,Progreso Reserves,8.6,5.0,1.28,0,0,0
08-09-25,19:52,"Uruguay Tercera Division, Reserves",Liverpool Montevideo Reserves vs Nacional de Montevideo Reserves,Liverpool Montevideo Reserves,Nacional de Montevideo Reserves,2.5,3.1,2.65,1,0,1
08-09-25,19:52,"Uruguay Tercera Division, Reserves",Miramar Misiones Reserves vs CA Boston River Reserves,Miramar Misiones Reserves,CA Boston River Reserves,3.4,3.2,2.05,1,0,1
08-09-25,19:52,"Uruguay Tercera Division, Reserves",Racing Club de Montevideo Reserves vs Montevideo Wanderers Reserves,Racing Club de Montevideo Reserves,Montevideo Wanderers Reserves,2.7,3.3,2.35,0,0,0
08-09-25,19:52,,Sama AL Sarhan SC vs Al Hussein Irbid,Sama AL Sarhan SC,Al Hussein Irbid,,,,0,0,0
08-09-25,19:52,"Argentina Primera Division, Women",Newell's Old Boys vs CA Huracan,Newell's Old Boys,CA Huracan,1.33,4.25,8.9,0,0,0
08-09-25,19:52,,Defensores de Glew vs FC Ezeiza,Defensores de Glew,FC Ezeiza,,,,1,0,1
08-09-25,19:52,,Deportivo Metalurgico vs Nautico Hacoaj,Deportivo Metalurgico,Nautico Hacoaj,,,,0,0,0
08-09-25,19:52,,Social Atlético Televisión vs Estrella de Berisso,Social Atlético Televisión,Estrella de Berisso,,,,1,0,1
08-09-25,20:09,,Belgrano de Zarate vs Club Atletico Pilar,Belgrano de Zarate,Club Atletico Pilar,,,,0,0,0
08-09-25,20:24,Spain LaLiga 2,Eibar vs FC Andorra,Eibar,FC Andorra,1.82,3.4,4.6,0,0,0
08-09-25,20:24,Argentina Primera B,CD UAI Urquiza vs Real Pilar FC,CD UAI Urquiza,Real Pilar FC,3.5,2.95,2.2,0,0,0
08-09-25,20:24,Argentina Primera B,CSD Flandria vs CSCD Laferrere,CSD Flandria,CSCD Laferrere,2.15,2.8,3.9,0,0,0
08-09-25,20:35,International World Cup Qualification UEFA,Belarus vs Scotland,Belarus,Scotland,6.75,3.9,1.55,0,1,1
08-09-25,20:35,International World Cup Qualification UEFA,Croatia vs Montenegro,Croatia,Montenegro,1.2,6.7,14.5,1,0,1
08-09-25,20:35,International World Cup Qualification UEFA,Gibraltar vs Faroe Islands,Gibraltar,Faroe Islands,7.2,3.9,1.53,0,0,0
08-09-25,20:35,International World Cup Qualification UEFA,Greece vs Denmark,Greece,Denmark,2.5,3.1,3.0,0,1,1
08-09-25,20:35,Argentina Primera C,CDM Leandro N. Alem vs CA Central Cordoba Rosario,CDM Leandro N. Alem,CA Central Cordoba Rosario,3.1,3.25,2.3,1,0,1
08-09-25,20:35,,Mayfield United vs Carrigaline United,Mayfield United,Carrigaline United,,,,1,0,1
08-09-25,20:35,,Portadown FC vs Linfield Swifts,Portadown FC,Linfield Swifts,,,,0,1,1
08-09-25,20:54,"International World Cup, Qualification CAF",Ghana vs Mali,Ghana,Mali,2.25,3.0,3.6,0,0,0
08-09-25,20:54,International Youth U21 Friendly Games,France vs Serbia,France,Serbia,1.25,4.9,13.0,1,0,1
08-09-25,20:54,,Bangor FC Reserves vs Dungannon Swifts,Bangor FC Reserves,Dungannon Swifts,,,,1,0,1
08-09-25,21:53,,Alianza Lima Reserves vs Juventus Huamachuco FC,Alianza Lima Reserves,Juventus Huamachuco FC,,,,0,0,0
08-09-25,22:50,Argentina Primera Nacional,Almirante Brown vs CA San Telmo,Almirante Brown,CA San Telmo,2.05,2.9,4.0,0,0,0
08-09-25,22:59,,Atletico MT vs Mixto EC MT,Atletico MT,Mixto EC MT,,,,0,1,1
08-09-25,23:23,"Paraguay Division de Honor, Clausura",Sportivo Trinidense vs Sportivo Ameliano,Sportivo Trinidense,Sportivo Ameliano,2.25,3.1,3.2,1,0,1
08-09-25,23:23,Paraguay Segunda Division,Independiente Campo Grande vs Rubio Nu,Independiente Campo Grande,Rubio Nu,3.5,3.2,1.98,0,1,1
08-09-25,23:37,Argentina Primera B,CA Brown de Adrogue vs CSD San Martin,CA Brown de Adrogue,CSD San Martin,1.8,3.2,4.7,0,0,0
08-09-25,23:59,Argentina Primera Nacional,Colon de Santa Fe vs Estudiantes Rio Cuarto,Colon de Santa Fe,Estudiantes Rio Cuarto,2.45,2.85,3.1,0,1,1
08-09-25,23:59,Argentina Primera Nacional,Quilmes AC vs Ferro Carril Oeste,Quilmes AC,Ferro Carril Oeste,2.1,2.85,4.0,0,0,0
09-09-25,08:53,Simulated Reality League World Cup Qualifiers SRL,Albania SRL vs Latvia SRL,Albania SRL,Latvia SRL,1.38,4.54,9.5,0,0,0
09-09-25,08:53,Simulated Reality League World Cup Qualifiers SRL,Armenia SRL vs Ireland SRL,Armenia SRL,Ireland SRL,4.68,3.55,1.8,0,1,1
09-09-25,08:53,Simulated Reality League World Cup Qualifiers SRL,Azerbaijan SRL vs Ukraine SRL,Azerbaijan SRL,Ukraine SRL,6.4,4.31,1.51,0,0,0
09-09-25,08:53,Simulated Reality League World Cup Qualifiers SRL,Bosnia & Herzegovina SRL vs Austria SRL,Bosnia & Herzegovina SRL,Austria SRL,4.96,3.64,1.74,0,1,1
09-09-25,08:53,,Yirga Chefe Bunna SC vs Bole Sub City,Yirga Chefe Bunna SC,Bole Sub City,,,,0,0,0
09-09-25,09:55,Simulated Reality League World Cup Qualifiers SRL,France SRL vs Iceland SRL,France SRL,Iceland SRL,1.1,10.2,25.25,0,0,0
09-09-25,09:55,Simulated Reality League World Cup Qualifiers SRL,Serbia SRL vs England SRL,Serbia SRL,England SRL,4.64,3.61,1.79,0,0,0
09-09-25,09:55,,Mumbai Marines SC vs Mumbai Warriors SC,Mumbai Marines SC,Mumbai Warriors SC,,,,0,1,1
09-09-25,10:17,,Than Khoang San Viet Nam vs TP Ho Chi Minh II,Than Khoang San Viet Nam,TP Ho Chi Minh II,,,,1,0,1
09-09-25,10:35,International Youth U19 Friendly Games,Italy vs Czechia,Italy,Czechia,1.75,3.8,4.1,1,0,1
09-09-25,10:58,"International Youth U23 AFC Championship, Qualification",Oman vs Pakistan,Oman,Pakistan,1.19,6.3,10.5,1,0,1
09-09-25,10:58,"International Youth U23 AFC Championship, Qualification",Singapore vs Bangladesh,Singapore,Bangladesh,2.1,3.33,3.1,0,0,0
09-09-25,10:58,,Finland vs Switzerland,Finland,Switzerland,,,,0,0,0
09-09-25,11:24,,Coal India Spa vs Eastern Railway SC,Coal India Spa,Eastern Railway SC,,,,0,0,0
09-09-25,16:24,Slovakia Slovensky Pohar,FK Slovan Duslo Sala vs OFK Dynamo Malzenice,FK Slovan Duslo Sala,OFK Dynamo Malzenice,3.25,3.5,2.05,1,0,1
09-09-25,16:24,Slovakia Slovensky Pohar,TJ Banik Kalinovo vs FC Vion Zlate Moravce - Vrable,TJ Banik Kalinovo,FC Vion Zlate Moravce - Vrable,10.5,5.9,1.23,0,1,1
09-09-25,16:24,,"Hong Kong, China vs Guam U23","Hong Kong, China",Guam U23,,,,1,0,1
09-09-25,16:24,Croatia Croatian Cup,NK Solin vs NK Rudes Zagreb,NK Solin,NK Rudes Zagreb,3.25,3.33,2.1,0,1,1
09-09-25,16:52,"International Youth U21 UEFA European Championship, Qualification",Netherlands vs Israel,Netherlands,Israel,1.17,6.6,13.0,0,0,0
09-09-25,16:52,Portugal U23 Liga Revelacao,Rio Ave vs FC Vizela U23,Rio Ave,FC Vizela U23,,,,0,0,0
09-09-25,16:52,International Youth U19 Friendly Games,Croatia vs Germany,Croatia,Germany,2.8,3.8,2.2,1,0,1
09-09-25,16:52,,Cdm Leandro N. Alem II vs Argentino de Rosario Reserve,Cdm Leandro N. Alem II,Argentino de Rosario Reserve,,,,0,0,0
09-09-25,16:52,Finland Kolmonen,Korsnas FF vs Seinaajoen Sisu,Korsnas FF,Seinaajoen Sisu,2.25,4.1,2.45,0,0,0
09-09-25,17:51,International World Cup Qualification UEFA,Armenia vs Ireland,Armenia,Ireland,4.3,3.5,1.88,1,0,1
09-09-25,17:51,International World Cup Qualification UEFA,Azerbaijan vs Ukraine,Azerbaijan,Ukraine,6.9,4.4,1.48,0,0,0
09-09-25,17:51,"International World Cup, Qualification CAF",Burkina Faso vs Egypt,Burkina Faso,Egypt,2.95,3.25,2.4,0,0,0
09-09-25,17:51,"International World Cup, Qualification CAF",Togo vs Sudan,Togo,Sudan,2.3,3.0,3.4,1,0,1
09-09-25,17:51,International Int. Friendly Games,Estonia vs Andorra,Estonia,Andorra,1.56,3.7,6.75,0,0,0
09-09-25,17:51,"International Youth U21 UEFA European Championship, Qualification",Georgia vs Northern Ireland,Georgia,Northern Ireland,1.69,3.75,4.5,1,0,1
09-09-25,17:51,"International Youth U21 UEFA European Championship, Qualification",Lithuania vs Hungary,Lithuania,Hungary,5.5,4.0,1.54,0,1,1
09-09-25,17:51,"International Youth U21 UEFA European Championship, Qualification",Moldova vs Slovakia,Moldova,Slovakia,7.4,4.7,1.36,1,0,1
09-09-25,17:51,"International Youth U23 AFC Championship, Qualification",Jordan vs Turkmenistan,Jordan,Turkmenistan,1.32,5.1,6.8,1,0,1
09-09-25,17:51,"International Youth U23 AFC Championship, Qualification",Tajikistan vs Syria,Tajikistan,Syria,2.2,3.5,2.8,0,0,0
09-09-25,17:51,"Finland Kakkonen, Group B",Tampereen Ilves 2 vs HJS,Tampereen Ilves 2,HJS,1.72,4.25,3.8,0,0,0
09-09-25,18:01,"International World Cup, Qualification CAF",Cape Verde vs Cameroon,Cape Verde,Cameroon,3.25,2.8,2.5,0,0,0
09-09-25,18:23,"Netherlands U21, Divisie 1",Willem II Tilburg U21 vs FC Groningen U21,Willem II Tilburg U21,FC Groningen U21,2.3,3.6,2.55,0,0,0
09-09-25,18:52,International Int. Friendly Games,Jordan vs Dominican Republic,Jordan,Dominican Republic,1.98,3.4,3.9,1,0,1
09-09-25,18:52,"International Youth U21 UEFA European Championship, Qualification",Turkiye vs Croatia,Turkiye,Croatia,2.45,3.3,2.75,0,0,0
09-09-25,18:52,,Syrianska FC vs Orebro SK,Syrianska FC,Orebro SK,,,,0,0,0
