date,log_time,title,home-team,away-team,ht_goals,criteria_met,ft_goals
06-09-25,11:48,Real Union de Tenerife Santa Cruz vs SD Tenisca,Real Union de Tenerife Santa Cruz,SD Tenisca,1,unknown,unknown
06-09-25,11:48,Sri Lanka vs Palestine,Sri Lanka,Palestine,1,unknown,unknown
06-09-25,11:48,Bumamuru FC vs Kmc FC,Bumamuru FC,Kmc FC,1,unknown,unknown
06-09-25,11:48,FC Vizela vs FC Famalicao,FC Vizela,FC Famalicao,1,unknown,unknown
06-09-25,11:48,Ajax SRL vs Liverpool SRL,Ajax SRL,Liverpool SRL,0,unknown,unknown
06-09-25,11:48,Ferencvarosi Tc SRL vs Fenerbahce SRL,Ferencvarosi Tc SRL,Fenerbahce SRL,1,unknown,unknown
06-09-25,11:48,Atletic Olimpia Gherla vs VASAS FEMINA FC,Atletic Olimpia Gherla,VASAS FEMINA FC,1,unknown,unknown
