date,time,title,tournament,game-id,home-team,away-team,pre-match_odds_home,pre-match_odds_draw,pre-match_odds_away
13-09-25,16:00,Jfk Ventspils vs FK Beitar / Riga Mariners,Latvia 1.Liga,22523,Jfk Ventspils,FK Beitar / Riga Mariners,3.0,4.0,1.93
13-09-25,13:30,FC Admira Wacker Modling vs Schwarz-Weiss Bregenz,Austria 2. Liga,44724,FC Admira Wacker Modling,Schwarz-Weiss Bregenz,1.36,5.1,7.3
13-09-25,19:00,Young Violets Wien vs First Vienna FC 1894,Austria 2. Liga,20053,Young Violets Wien,First Vienna FC 1894,3.6,3.4,2.0
13-09-25,08:30,Persipal FC vs Persipura Jayapura,Indonesia Championship,29155,Persipal FC,Persipura Jayapura,2.5,2.95,2.75
13-09-25,09:30,Persipal (Babel United) vs Persipura Jayapura,Indonesia Championship,33974,Persipal (Babel United),Persipura Jayapura,2.45,2.95,2.6
13-09-25,14:30,Persiraja Banda vs Adhyaksa Farmel FC,Indonesia Championship,16265,Persiraja Banda,Adhyaksa Farmel FC,1.65,3.33,5.1
13-09-25,16:00,FC Dinamo Tbilisi vs FC Gagra,Georgia Erovnuli Liga,21197,FC Dinamo Tbilisi,FC Gagra,1.56,3.6,5.4
13-09-25,17:00,FC Telavi vs FC Gareji Sagarejo,Georgia Erovnuli Liga,28545,FC Telavi,FC Gareji Sagarejo,2.9,3.1,2.35
13-09-25,18:00,FC Torpedo Kutaisi vs FC Samgurali Tskaltubo,Georgia Erovnuli Liga,11813,FC Torpedo Kutaisi,FC Samgurali Tskaltubo,1.75,3.25,4.5
13-09-25,11:00,IFK Stocksund vs FC Stockholm Internazionale,"Sweden Ettan, Norra",22347,IFK Stocksund,FC Stockholm Internazionale,7.5,5.2,1.33
13-09-25,12:00,IFK Haninge vs Orebro Syrianska IF,"Sweden Ettan, Norra",29509,IFK Haninge,Orebro Syrianska IF,1.64,4.25,4.25
13-09-25,15:00,AFC Eskilstuna vs Gefle IF,"Sweden Ettan, Norra",29332,AFC Eskilstuna,Gefle IF,2.25,3.5,2.85
13-09-25,15:00,IF Karlstad Fotbol vs Karlbergs BK,"Sweden Ettan, Norra",19190,IF Karlstad Fotbol,Karlbergs BK,1.72,4.1,3.9
13-09-25,15:00,United IK Nordic vs Hammarby Talang FF,"Sweden Ettan, Norra",23333,United IK Nordic,Hammarby Talang FF,2.45,3.33,2.7
13-09-25,12:00,Husqvarna FF vs Angelholms FF,"Sweden Ettan, Sodra",35527,Husqvarna FF,Angelholms FF,2.5,3.7,2.45
13-09-25,12:00,Torslanda IK vs BK Olympic,"Sweden Ettan, Sodra",36287,Torslanda IK,BK Olympic,2.6,3.5,2.5
13-09-25,15:00,Ariana FC vs IFK Skovde FK,"Sweden Ettan, Sodra",20391,Ariana FC,IFK Skovde FK,1.27,5.6,8.7
13-09-25,15:00,FC Rosengaard 1917 vs Oskarshamns AIK,"Sweden Ettan, Sodra",36757,FC Rosengaard 1917,Oskarshamns AIK,1.55,4.1,5.2
13-09-25,15:00,Ljungskile SK vs Hassleholms IF,"Sweden Ettan, Sodra",36849,Ljungskile SK,Hassleholms IF,1.8,3.8,3.8
13-09-25,09:15,MFK Chrudim vs FK Usti nad Labem,Czechia FNL,34261,MFK Chrudim,FK Usti nad Labem,2.6,3.6,2.4
13-09-25,18:00,SK Artis Brno vs Sparta Prague B,Czechia FNL,22317,SK Artis Brno,Sparta Prague B,1.39,4.6,6.8
13-09-25,00:15,CD Victoria La Ceiba vs Juticalpa FC,"Honduras Liga Nacional, Apertura",42802,CD Victoria La Ceiba,Juticalpa FC,1.73,3.8,4.2
13-09-25,15:30,AD Sanjoanense vs SC Sao Joao de Ver,Portugal Liga Portugal 3,32793,AD Sanjoanense,SC Sao Joao de Ver,2.0,3.3,3.33
13-09-25,15:30,CD Trofense vs AD Fafe,Portugal Liga Portugal 3,28120,CD Trofense,AD Fafe,2.3,3.0,2.95
13-09-25,15:30,Vitoria Guimaraes B vs SC Braga B,Portugal Liga Portugal 3,40198,Vitoria Guimaraes B,SC Braga B,2.4,3.2,2.65
13-09-25,17:00,Lusitano GC vs Atletico CP,Portugal Liga Portugal 3,41151,Lusitano GC,Atletico CP,2.4,3.0,2.85
13-09-25,18:00,Academica de Coimbra vs CF Os Belenenses,Portugal Liga Portugal 3,32870,Academica de Coimbra,CF Os Belenenses,2.85,3.1,2.35
13-09-25,12:30,Tanjong Pagar United FC vs BG Tampines Rovers,Singapore Premier League,44824,Tanjong Pagar United FC,BG Tampines Rovers,9.5,6.7,1.21
13-09-25,15:00,Carrick Rangers vs Bangor FC,Northern Ireland Premiership,27302,Carrick Rangers,Bangor FC,1.62,4.1,4.75
13-09-25,15:00,Cliftonville FC vs Ballymena United,Northern Ireland Premiership,27423,Cliftonville FC,Ballymena United,1.88,3.7,3.8
13-09-25,15:00,Dungannon Swifts vs Crusaders FC,Northern Ireland Premiership,27605,Dungannon Swifts,Crusaders FC,2.25,3.6,2.9
13-09-25,15:00,Larne FC vs Glenavon FC,Northern Ireland Premiership,27624,Larne FC,Glenavon FC,1.42,4.5,7.2
13-09-25,15:00,Portadown FC vs Coleraine FC,Northern Ireland Premiership,27717,Portadown FC,Coleraine FC,5.6,4.1,1.54
13-09-25,00:00,CS Herediano vs Sporting FC,"Costa Rica Primera Division, Apertura",37471,CS Herediano,Sporting FC,1.6,3.8,5.2
13-09-25,15:00,Silva SD vs Atletico Coruna Montaneros CF,"Spain Amateur Tercera Federacion, Group 1",20521,Silva SD,Atletico Coruna Montaneros CF,2.1,3.2,3.25
13-09-25,17:00,Alondras CF vs CF Noia,"Spain Amateur Tercera Federacion, Group 1",44803,Alondras CF,CF Noia,1.94,3.3,3.6
13-09-25,17:15,Celtiga CF vs UD Somozas,"Spain Amateur Tercera Federacion, Group 1",17716,Celtiga CF,UD Somozas,2.25,3.2,2.95
13-09-25,15:00,AD Ceuta FC B vs Atletico Onubense,"Spain Amateur Tercera Federacion, Group 10",43201,AD Ceuta FC B,Atletico Onubense,2.05,3.1,3.4
13-09-25,17:00,UD Rotlet Molinar vs CE Felanitx,"Spain Amateur Tercera Federacion, Group 11",44811,UD Rotlet Molinar,CE Felanitx,2.15,3.33,3.0
13-09-25,18:00,SD Portmany vs SCR Pena Deportiva,"Spain Amateur Tercera Federacion, Group 11",45569,SD Portmany,SCR Pena Deportiva,7.4,4.0,1.4
13-09-25,11:00,Arucas CF vs CF Panaderia Pulido,"Spain Amateur Tercera Federacion, Group 12",44243,Arucas CF,CF Panaderia Pulido,2.35,3.0,2.95
13-09-25,12:15,San Bartolome CF vs CD Marino,"Spain Amateur Tercera Federacion, Group 12",20588,San Bartolome CF,CD Marino,2.1,3.1,3.4
13-09-25,16:00,CD Tenerife C vs CD Mensajero,"Spain Amateur Tercera Federacion, Group 12",24362,CD Tenerife C,CD Mensajero,3.0,3.33,2.1
13-09-25,17:00,El Palmar CF-Estrella Grana vs Real Murcia Imperial FC,"Spain Amateur Tercera Federacion, Group 13",42721,El Palmar CF-Estrella Grana,Real Murcia Imperial FC,2.2,3.25,3.0
13-09-25,17:30,CF Santomera vs CD Cieza,"Spain Amateur Tercera Federacion, Group 13",12914,CF Santomera,CD Cieza,5.9,3.8,1.5
13-09-25,18:00,Aguilas FC B vs CA Pulpileno,"Spain Amateur Tercera Federacion, Group 13",44688,Aguilas FC B,CA Pulpileno,2.0,3.1,3.5
13-09-25,15:00,Beti Kozkor KE vs CA Cirbonero,"Spain Amateur Tercera Federacion, Group 15",24460,Beti Kozkor KE,CA Cirbonero,2.7,2.95,2.6
13-09-25,15:00,CD Beti Onak vs AD San Juan Pamplona,"Spain Amateur Tercera Federacion, Group 15",45395,CD Beti Onak,AD San Juan Pamplona,4.6,3.3,1.73
13-09-25,15:30,CD Egues vs Udc Txantrea Kke,"Spain Amateur Tercera Federacion, Group 15",24676,CD Egues,Udc Txantrea Kke,1.96,3.2,3.6
13-09-25,17:30,CD Manchego Ciudad Real vs AD San Clemente,"Spain Amateur Tercera Federacion, Group 18",45396,CD Manchego Ciudad Real,AD San Clemente,1.8,3.33,4.1
13-09-25,18:00,Atletico Albacete vs CD Pedroneras,"Spain Amateur Tercera Federacion, Group 18",45753,Atletico Albacete,CD Pedroneras,1.13,6.4,16.5
13-09-25,18:00,CD Illescas vs CD Villacanas,"Spain Amateur Tercera Federacion, Group 18",45397,CD Illescas,CD Villacanas,1.83,3.3,4.0
13-09-25,16:30,CD Llanes vs CD Praviano,"Spain Amateur Tercera Federacion, Group 2",45752,CD Llanes,CD Praviano,3.0,3.1,2.25
13-09-25,15:30,Pasaia Ke vs CD Aurrera de Vitoria,"Spain Amateur Tercera Federacion, Group 4",45751,Pasaia Ke,CD Aurrera de Vitoria,2.0,3.4,3.2
13-09-25,17:00,CF Vilanova I LA Geltru vs FE Grama,"Spain Amateur Tercera Federacion, Group 5",42794,CF Vilanova I LA Geltru,FE Grama,2.4,3.3,2.65
13-09-25,18:30,UE Cornella vs CF Peralada,"Spain Amateur Tercera Federacion, Group 5",42750,UE Cornella,CF Peralada,1.75,3.5,4.1
13-09-25,18:30,UE Vilassar de Mar vs CE Manresa,"Spain Amateur Tercera Federacion, Group 5",42756,UE Vilassar de Mar,CE Manresa,2.5,3.1,2.65
13-09-25,17:00,AC Torrellano vs UD Castellonense,"Spain Amateur Tercera Federacion, Group 6",42706,AC Torrellano,UD Castellonense,2.75,3.0,2.5
13-09-25,18:00,Atletico Levante UD vs Hercules CF B,"Spain Amateur Tercera Federacion, Group 6",42731,Atletico Levante UD,Hercules CF B,2.2,3.0,3.25
13-09-25,18:30,FC Jove Espanol San Vicente vs CF La Nucia,"Spain Amateur Tercera Federacion, Group 6",44810,FC Jove Espanol San Vicente,CF La Nucia,2.45,3.1,2.8
13-09-25,15:00,AD Alcorcon B vs CF Pozuelo de Alarcon,"Spain Amateur Tercera Federacion, Group 7",44773,AD Alcorcon B,CF Pozuelo de Alarcon,1.7,3.6,4.3
13-09-25,16:00,Mexico FC vs Cdb Siello FC,"Spain Amateur Tercera Federacion, Group 7",23524,Mexico FC,Cdb Siello FC,2.05,3.2,3.3
13-09-25,15:00,Atletico Tordesillas vs CD Colegios Diocesanos,"Spain Amateur Tercera Federacion, Group 8",44774,Atletico Tordesillas,CD Colegios Diocesanos,1.4,4.1,6.9
13-09-25,16:00,CD Numancia B vs CD Villaralbo,"Spain Amateur Tercera Federacion, Group 8",42696,CD Numancia B,CD Villaralbo,2.45,3.2,2.65
13-09-25,17:00,UD Santa Marta vs Cultural Deportiva Leonesa B,"Spain Amateur Tercera Federacion, Group 8",44986,UD Santa Marta,Cultural Deportiva Leonesa B,2.4,3.2,2.65
13-09-25,18:00,Atletico Bembibre vs CD Mojados,"Spain Amateur Tercera Federacion, Group 8",42741,Atletico Bembibre,CD Mojados,2.0,3.1,3.5
13-09-25,15:00,PFK Arsenal Tula vs Spartak Kostroma,Russia 1. Liga,39090,PFK Arsenal Tula,Spartak Kostroma,1.91,3.1,4.5
13-09-25,17:00,AC Omonia Nicosia vs Akritas Chlorakas,Cyprus 1st Division,11754,AC Omonia Nicosia,Akritas Chlorakas,1.26,5.75,10.0
13-09-25,18:00,Anorthosis Famagusta vs AEK Larnaca,Cyprus 1st Division,14201,Anorthosis Famagusta,AEK Larnaca,4.3,3.6,1.8
13-09-25,18:00,Pafos FC vs Apollon Limassol,Cyprus 1st Division,30624,Pafos FC,Apollon Limassol,1.48,4.2,6.4
13-09-25,15:00,FC STK 1914 Samorin vs FK Inter Bratislava,Slovakia 2. Liga,41200,FC STK 1914 Samorin,FK Inter Bratislava,2.2,3.5,2.8
13-09-25,15:00,MFK Stara Lubovna vs OFK Banik Lehota Pod Vtacnikom,Slovakia 2. Liga,41196,MFK Stara Lubovna,OFK Banik Lehota Pod Vtacnikom,1.54,4.2,4.75
13-09-25,15:00,MFK Zvolen vs FC Vion Zlate Moravce - Vrable,Slovakia 2. Liga,41142,MFK Zvolen,FC Vion Zlate Moravce - Vrable,3.5,3.4,1.92
13-09-25,15:00,MSK Puchov vs Slavia Tu Kosice,Slovakia 2. Liga,41197,MSK Puchov,Slavia Tu Kosice,1.35,5.2,5.9
13-09-25,21:00,Cavalry FC vs HFX Wanderers FC,Canada Canadian Premier League,39669,Cavalry FC,HFX Wanderers FC,2.05,3.4,3.33
13-09-25,00:00,Pacific FC vs Vancouver Langley FC,Canada Canadian Premier League,36275,Pacific FC,Vancouver Langley FC,2.2,3.4,3.0
13-09-25,09:00,FK Pribram B vs Bohemians Prague 1905 B,Czechia CFL,38650,FK Pribram B,Bohemians Prague 1905 B,2.3,3.6,2.4
13-09-25,09:00,SK Sparta Kolin vs FK Pardubice B,Czechia CFL,36462,SK Sparta Kolin,FK Pardubice B,2.0,3.5,3.2
13-09-25,09:15,FK Jablonec B vs FK Mlada Boleslav B,Czechia CFL,41585,FK Jablonec B,FK Mlada Boleslav B,1.68,3.8,4.1
13-09-25,09:15,N. Byskovice vs FK Varnsdorf,Czechia CFL,40333,N. Byskovice,FK Varnsdorf,1.49,4.5,4.8
13-09-25,09:15,SK Aritma Prague vs SK Kladno,Czechia CFL,38357,SK Aritma Prague,SK Kladno,5.2,4.3,1.48
13-09-25,09:30,FK Kraluv Dvur vs FC Viktoria Plzen B,Czechia CFL,40030,FK Kraluv Dvur,FC Viktoria Plzen B,3.4,3.7,1.88
13-09-25,09:30,SK Dynamo Ceske Budejovice B vs ZCE Plzen,Czechia CFL,21393,SK Dynamo Ceske Budejovice B,ZCE Plzen,1.73,3.8,3.8
13-09-25,16:00,Tj Jiskra Domazlice vs Loko Vltavin,Czechia CFL,39424,Tj Jiskra Domazlice,Loko Vltavin,1.27,5.2,8.1
13-09-25,15:00,Ballinamallard United vs Annagh United FC,Northern Ireland Championship,23850,Ballinamallard United,Annagh United FC,4.3,3.75,1.67
13-09-25,15:00,Dundela FC vs Institute FC,Northern Ireland Championship,41434,Dundela FC,Institute FC,2.75,3.5,2.2
13-09-25,15:00,Queens University vs Armagh City FC,Northern Ireland Championship,23875,Queens University,Armagh City FC,2.2,3.8,2.6
13-09-25,13:00,Motala AIF FK vs IK Kongahalla,"Sweden Division 2, Norra Gotaland",37118,Motala AIF FK,IK Kongahalla,2.35,3.75,2.45
13-09-25,14:00,Skara FC vs Grebbestads IF,"Sweden Division 2, Norra Gotaland",38796,Skara FC,Grebbestads IF,1.83,4.3,3.1
13-09-25,15:00,IK Tord vs Herrestads AIF,"Sweden Division 2, Norra Gotaland",44061,IK Tord,Herrestads AIF,2.7,3.5,2.3
13-09-25,15:00,Vanersborgs IF vs IFK Kumla,"Sweden Division 2, Norra Gotaland",27893,Vanersborgs IF,IFK Kumla,1.96,3.7,3.1
13-09-25,11:30,FC Gute vs Falu BS FK,"Sweden Division 2, Norra Svealand",39296,FC Gute,Falu BS FK,2.9,3.9,2.0
13-09-25,13:00,Bollstanas SK vs Sunnersta AIF,"Sweden Division 2, Norra Svealand",23117,Bollstanas SK,Sunnersta AIF,2.25,3.6,2.65
13-09-25,13:00,IFK Osteraaker FK vs FC Nacka Iliria,"Sweden Division 2, Norra Svealand",26315,IFK Osteraaker FK,FC Nacka Iliria,7.6,5.5,1.27
13-09-25,11:00,Kiruna FF vs Taftea IK,"Sweden Division 2, Norrland",42697,Kiruna FF,Taftea IK,2.1,3.8,3.0
13-09-25,12:00,Kubikenborgs IF vs Piteaa IF,"Sweden Division 2, Norrland",42698,Kubikenborgs IF,Piteaa IF,5.5,4.75,1.46
13-09-25,12:00,Lucksta IF vs Bodens BK,"Sweden Division 2, Norrland",42700,Lucksta IF,Bodens BK,2.6,4.0,2.3
13-09-25,14:00,Gottne IF vs IFK Ostersund,"Sweden Division 2, Norrland",42703,Gottne IF,IFK Ostersund,3.25,3.7,1.99
13-09-25,12:00,Hogaborgs BK vs Vaxjo Norra,"Sweden Division 2, Sodra Gotaland",44657,Hogaborgs BK,Vaxjo Norra,2.35,3.5,2.6
13-09-25,13:00,Torns IF vs IFK Trelleborg,"Sweden Division 2, Sodra Gotaland",30127,Torns IF,IFK Trelleborg,2.55,3.5,2.35
13-09-25,14:00,Hestrafors IF vs BK Astrio,"Sweden Division 2, Vastra Gotaland",43932,Hestrafors IF,BK Astrio,3.6,3.9,1.77
13-09-25,20:30,Club General Caballero JLM vs Cerro Porteno,"Paraguay Division de Honor, Clausura",37358,Club General Caballero JLM,Cerro Porteno,4.5,3.6,1.73
13-09-25,23:00,Sportivo Luqueno vs Libertad Asuncion,"Paraguay Division de Honor, Clausura",37464,Sportivo Luqueno,Libertad Asuncion,4.2,3.4,1.83
13-09-25,13:00,GKS Jastrzebie vs MKS Chojniczanka Chojnice,Poland II Liga,30601,GKS Jastrzebie,MKS Chojniczanka Chojnice,4.0,3.6,1.81
13-09-25,13:00,Rekord Bielsko Biala vs Zaglebie Sosnowiec,Poland II Liga,36630,Rekord Bielsko Biala,Zaglebie Sosnowiec,2.4,3.5,2.7
13-09-25,15:30,Sandecja Nowy Sacz vs ZKS Stal Stalowa Wola,Poland II Liga,36633,Sandecja Nowy Sacz,ZKS Stal Stalowa Wola,2.65,3.4,2.45
13-09-25,15:00,KS Warta Sieradz vs Legia Warszawa II,"Poland III Liga, Group 1",35572,KS Warta Sieradz,Legia Warszawa II,2.4,3.7,2.45
13-09-25,15:00,Mlks Znicz Biala Piska vs Widzew Lodz II,"Poland III Liga, Group 1",33747,Mlks Znicz Biala Piska,Widzew Lodz II,3.0,3.6,2.05
13-09-25,15:00,PKS Olimpia Elblag vs Swit Nowy Dwor Mazowiecki,"Poland III Liga, Group 1",33370,PKS Olimpia Elblag,Swit Nowy Dwor Mazowiecki,2.3,3.8,2.5
13-09-25,15:30,MKS Mlawianka Mlawa vs GKS Belchatow,"Poland III Liga, Group 1",33839,MKS Mlawianka Mlawa,GKS Belchatow,2.55,3.75,2.25
13-09-25,18:00,Wigry Suwalki vs GKS Wikielec,"Poland III Liga, Group 1",35838,Wigry Suwalki,GKS Wikielec,1.83,3.7,3.5
13-09-25,11:00,LKS Wybrzeze Rewalskie Rewal vs KTS-K Luzino,"Poland III Liga, Group 2",37058,LKS Wybrzeze Rewalskie Rewal,KTS-K Luzino,3.33,3.9,1.83
13-09-25,14:00,Blekitni Stargard vs Lech II Poznan,"Poland III Liga, Group 2",37396,Blekitni Stargard,Lech II Poznan,2.05,3.7,3.0
13-09-25,14:00,Gzs Tluchovia Tluchowo vs GKS Przodkowo,"Poland III Liga, Group 2",37397,Gzs Tluchovia Tluchowo,GKS Przodkowo,2.9,3.7,2.05
13-09-25,16:00,MKS Flota Swinoujscie vs Zks Kluczevia Stargard,"Poland III Liga, Group 2",35553,MKS Flota Swinoujscie,Zks Kluczevia Stargard,1.57,4.1,4.5
13-09-25,12:00,Gornik Zabrze II vs BKS Sparta Katowice,"Poland III Liga, Group 3",40026,Gornik Zabrze II,BKS Sparta Katowice,1.95,3.8,3.1
13-09-25,12:00,LKS Goczalkowice-Zdroj vs KS Sleza Wroclaw,"Poland III Liga, Group 3",40029,LKS Goczalkowice-Zdroj,KS Sleza Wroclaw,1.73,3.8,3.8
13-09-25,12:00,LZS Starowice vs Slowianin Woliborz,"Poland III Liga, Group 3",34396,LZS Starowice,Slowianin Woliborz,2.6,3.75,2.25
13-09-25,14:30,SKRA Czestochowa vs GKS Pniowek Pawlowice,"Poland III Liga, Group 3",40167,SKRA Czestochowa,GKS Pniowek Pawlowice,1.58,4.0,4.6
13-09-25,16:00,MKS Kluczbork vs Miedz Legnica II,"Poland III Liga, Group 3",30729,MKS Kluczbork,Miedz Legnica II,1.59,4.1,4.5
13-09-25,15:00,KS Naprzod Jedrzejow vs Wisla II Krakow,"Poland III Liga, Group 4",25278,KS Naprzod Jedrzejow,Wisla II Krakow,2.15,3.7,2.75
13-09-25,15:00,Star Starachowice vs Korona II Kielce SA,"Poland III Liga, Group 4",25301,Star Starachowice,Korona II Kielce SA,2.05,3.6,2.95
13-09-25,15:00,Swidniczanka Swidnik vs Cracovia Krakow II,"Poland III Liga, Group 4",25339,Swidniczanka Swidnik,Cracovia Krakow II,2.8,3.7,2.1
13-09-25,16:00,MKS Czarni Polaniec vs Sparta Kazimierza Wielka,"Poland III Liga, Group 4",37624,MKS Czarni Polaniec,Sparta Kazimierza Wielka,2.85,3.7,2.1
13-09-25,16:15,Chelmianka Chelm vs Avia Swidnik,"Poland III Liga, Group 4",39647,Chelmianka Chelm,Avia Swidnik,2.3,3.5,2.65
13-09-25,18:08,KS Wisloka Debica vs Siarka Tarnobrzeg,"Poland III Liga, Group 4",39759,KS Wisloka Debica,Siarka Tarnobrzeg,2.3,3.6,2.55
13-09-25,15:00,Canvey Island vs Whitehawk FC,"England Amateur Isthmian League, Pr. Div",38855,Canvey Island,Whitehawk FC,2.25,3.4,2.75
13-09-25,15:00,Carshalton Athletic FC vs Cray Wanderers,"England Amateur Isthmian League, Pr. Div",39355,Carshalton Athletic FC,Cray Wanderers,2.05,3.6,3.0
13-09-25,15:00,Ramsgate FC vs Potters Bar Town FC,"England Amateur Isthmian League, Pr. Div",41258,Ramsgate FC,Potters Bar Town FC,1.91,3.9,3.1
13-09-25,09:00,ACS Fotbal Club Bacau 2023 vs ACSM Resita,Romania Liga 2,29699,ACS Fotbal Club Bacau 2023,ACSM Resita,4.2,3.5,1.75
13-09-25,09:00,AFC Metalul Buzau vs CSC 1599 Selimbar,Romania Liga 2,27634,AFC Metalul Buzau,CSC 1599 Selimbar,1.87,3.3,3.8
13-09-25,09:00,CS Gloria 2018 Bistrita-Nasaud vs CS Dinamo Bucuresti,Romania Liga 2,31954,CS Gloria 2018 Bistrita-Nasaud,CS Dinamo Bucuresti,1.85,3.4,3.75
13-09-25,09:00,CSC Dumbravita vs ACS Sepsi OSK Sfantu Gheorghe,Romania Liga 2,27662,CSC Dumbravita,ACS Sepsi OSK Sfantu Gheorghe,5.2,3.6,1.59
13-09-25,09:00,CSM Slatina vs CS Tunari,Romania Liga 2,28811,CSM Slatina,CS Tunari,1.77,3.4,4.2
13-09-25,11:30,CS Afumati vs CSM Politehnica Iasi,Romania Liga 2,29788,CS Afumati,CSM Politehnica Iasi,3.2,3.1,2.15
13-09-25,00:00,CD Universitario Penonome vs Umecit,"Panama Liga Panamena, Clausura",37572,CD Universitario Penonome,Umecit,1.97,3.1,3.75
13-09-25,15:00,FC BKMA Yerevan vs FC Alashkert Yerevan,Armenia Premier League,44658,FC BKMA Yerevan,FC Alashkert Yerevan,4.2,3.7,1.76
13-09-25,17:45,Bnei Sakhnin FC vs Hapoel Haifa FC,Israel Premier League,40102,Bnei Sakhnin FC,Hapoel Haifa FC,2.85,3.33,2.45
13-09-25,17:45,Hapoel Petah Tikva FC vs Maccabi Netanya FC,Israel Premier League,40148,Hapoel Petah Tikva FC,Maccabi Netanya FC,2.75,3.4,2.45
13-09-25,18:00,Hapoel Ironi Kiryat Shmona FC vs Maccabi Bney Reine,Israel Premier League,40369,Hapoel Ironi Kiryat Shmona FC,Maccabi Bney Reine,2.5,3.33,2.8
13-09-25,18:00,Ironi Tiberias vs Maccabi Tel Aviv FC,Israel Premier League,29750,Ironi Tiberias,Maccabi Tel Aviv FC,10.5,5.9,1.26
13-09-25,16:30,NK Radomlje vs Olimpija Ljubljana,Slovenia PrvaLiga,39465,NK Radomlje,Olimpija Ljubljana,5.4,4.1,1.57
13-09-25,19:15,NK Maribor vs Mura Murska Sobota,Slovenia PrvaLiga,36560,NK Maribor,Mura Murska Sobota,1.34,5.25,7.7
13-09-25,16:00,Al Ahli Doha SC vs AL Wakrah SC,Qatar Stars League,39792,Al Ahli Doha SC,AL Wakrah SC,2.7,3.8,2.3
13-09-25,16:00,Al-Shamal vs Al Arabi Doha SC,Qatar Stars League,40048,Al-Shamal,Al Arabi Doha SC,2.5,3.9,2.4
13-09-25,18:00,Al Rayyan SC vs Qatar SC,Qatar Stars League,45522,Al Rayyan SC,Qatar SC,1.53,4.4,5.3
13-09-25,13:15,Cong An Ha Noi FC vs Hai Phong FC,Vietnam V-League 1,22412,Cong An Ha Noi FC,Hai Phong FC,1.43,4.5,6.3
13-09-25,13:15,Ho Chi Minh City FC vs Nam Dinh FC,Vietnam V-League 1,32957,Ho Chi Minh City FC,Nam Dinh FC,4.4,3.0,1.92
13-09-25,12:00,FC Smorgon vs Naftan Novopolotsk,Belarus Vysshaya Liga,37920,FC Smorgon,Naftan Novopolotsk,2.45,3.25,2.85
13-09-25,14:00,FC Slutsk vs Bate Borisov,Belarus Vysshaya Liga,37928,FC Slutsk,Bate Borisov,3.0,3.2,2.35
13-09-25,16:45,Maxline Rogachev vs FC Torpedo Belaz Zhodino,Belarus Vysshaya Liga,15759,Maxline Rogachev,FC Torpedo Belaz Zhodino,2.1,3.0,3.75
13-09-25,15:00,FK Jezero Plav vs FK Decic Tuzi,Montenegro 1. CFL,45695,FK Jezero Plav,FK Decic Tuzi,3.33,2.95,2.25
13-09-25,16:30,FK Bokelj Kotor vs FK Mornar Bar,Montenegro 1. CFL,45699,FK Bokelj Kotor,FK Mornar Bar,2.4,3.3,2.8
13-09-25,17:30,OFK Petrovac vs Mladost DG,Montenegro 1. CFL,45700,OFK Petrovac,Mladost DG,1.91,3.4,3.75
13-09-25,18:00,FK Buducnost vs FK Jedinstvo Bijelo Polje,Montenegro 1. CFL,45701,FK Buducnost,FK Jedinstvo Bijelo Polje,1.36,4.6,8.0
13-09-25,19:30,FK Sutjeska Niksic vs FK Arsenal Tivat,Montenegro 1. CFL,45702,FK Sutjeska Niksic,FK Arsenal Tivat,1.81,3.7,3.9
13-09-25,14:30,FK Akademija Pandev vs Shkupi Cair,North Macedonia 1. MFL,44802,FK Akademija Pandev,Shkupi Cair,1.58,3.8,4.8
13-09-25,14:30,FK Sileks Kratovo vs FK Rabotnicki Skopje,North Macedonia 1. MFL,43188,FK Sileks Kratovo,FK Rabotnicki Skopje,1.38,4.2,7.3
13-09-25,15:30,NK Dekani vs Tabor Sezana,Slovenia 2. Liga,40486,NK Dekani,Tabor Sezana,3.7,3.5,1.84
13-09-25,18:00,ND Gorica vs NK Bilje,Slovenia 2. Liga,41485,ND Gorica,NK Bilje,1.69,3.7,4.3
13-09-25,13:00,Erzgebirge Aue vs FC Viktoria Cologne,Germany 3. Liga,39408,Erzgebirge Aue,FC Viktoria Cologne,2.25,3.5,2.95
13-09-25,13:00,FC Ingolstadt 04 vs 1. FC Schweinfurt 05,Germany 3. Liga,39081,FC Ingolstadt 04,1. FC Schweinfurt 05,1.56,4.4,5.2
13-09-25,13:00,MSV Duisburg vs SV Wehen Wiesbaden,Germany 3. Liga,39421,MSV Duisburg,SV Wehen Wiesbaden,2.35,3.7,2.8
13-09-25,13:00,TSG Hoffenheim II vs SC Verl,Germany 3. Liga,29599,TSG Hoffenheim II,SC Verl,2.25,3.8,2.85
13-09-25,13:00,VfB Stuttgart II vs 1. FC Saarbrucken,Germany 3. Liga,39396,VfB Stuttgart II,1. FC Saarbrucken,2.95,3.6,2.25
13-09-25,15:30,Alemannia Aachen vs SSV Ulm 1846,Germany 3. Liga,39423,Alemannia Aachen,SSV Ulm 1846,2.45,3.3,2.9
13-09-25,21:00,Nautico PE vs Guarani FC SP,Brazil Brasileiro Serie C,38905,Nautico PE,Guarani FC SP,1.76,3.3,4.75
13-09-25,23:30,SER Caxias do Sul vs Sao Bernardo FC,Brazil Brasileiro Serie C,35710,SER Caxias do Sul,Sao Bernardo FC,2.1,3.1,3.6
13-09-25,13:00,FC Zeirey Tamra vs Hapoel Bnei Musmus,Israel Liga Alef,45503,FC Zeirey Tamra,Hapoel Bnei Musmus,2.7,3.33,2.45
13-09-25,19:00,Maccabi Neve Shaanan Eldad vs Hapoel Ironi Arraba,Israel Liga Alef,38693,Maccabi Neve Shaanan Eldad,Hapoel Ironi Arraba,3.3,3.33,2.1
13-09-25,20:00,Deportivo Upala FC vs Quepos Cambute,"Costa Rica Liga de Ascenso, Apertura",45854,Deportivo Upala FC,Quepos Cambute,1.93,3.5,3.7
13-09-25,20:15,CD Escorpiones Belen vs CS Uruguay de Coronado,"Costa Rica Liga de Ascenso, Apertura",45855,CD Escorpiones Belen,CS Uruguay de Coronado,1.76,3.7,4.2
13-09-25,00:00,Comunicaciones FC Guatemala City vs Antigua GFC,Guatemala Liga Nacional. Apertura,27240,Comunicaciones FC Guatemala City,Antigua GFC,2.1,3.25,3.4
13-09-25,09:15,FK Fotbal Trinec vs FC Zbrojovka Brno B,Czechia MSFL,34287,FK Fotbal Trinec,FC Zbrojovka Brno B,1.27,5.5,7.7
13-09-25,15:00,FK Blansko vs FC Vsetin,Czechia MSFL,37053,FK Blansko,FC Vsetin,1.98,3.9,3.0
13-09-25,15:00,FK Hodonin vs SK Hranice,Czechia MSFL,37036,FK Hodonin,SK Hranice,1.4,4.7,5.9
13-09-25,15:00,MFK Vitkovice vs SFK Vrchovina,Czechia MSFL,22037,MFK Vitkovice,SFK Vrchovina,1.96,3.5,3.33
13-09-25,15:00,TJ Start Brno vs FC Zlin B,Czechia MSFL,43062,TJ Start Brno,FC Zlin B,1.95,3.7,3.2
13-09-25,15:00,TJ Unie Hlubina vs FC Hlucin,Czechia MSFL,30352,TJ Unie Hlubina,FC Hlucin,2.35,3.75,2.45
13-09-25,17:30,FK Rudar Prijedor vs FK Velez Mostar,Bosnia & Herzegovina Premijer Liga,37867,FK Rudar Prijedor,FK Velez Mostar,4.5,3.5,1.74
13-09-25,22:00,Art Municipal Jalapa vs CD Walter Ferretti,Nicaragua Primera Division,33677,Art Municipal Jalapa,CD Walter Ferretti,3.9,3.7,1.81
13-09-25,13:15,NK Dugopolje vs NK Croatia Zmijavci,Croatia Prva NL,40885,NK Dugopolje,NK Croatia Zmijavci,2.35,3.1,2.85
13-09-25,15:30,NK BSK Bijelo Brdo vs NK Jarun Zagreb,Croatia Prva NL,40891,NK BSK Bijelo Brdo,NK Jarun Zagreb,1.94,3.25,3.6
13-09-25,15:30,NK Hrvace vs NK Karlovac 1919,Croatia Prva NL,40886,NK Hrvace,NK Karlovac 1919,3.33,3.5,1.93
13-09-25,15:30,NK Sesvete vs HNK Cibalia Vinkovci,Croatia Prva NL,14577,NK Sesvete,HNK Cibalia Vinkovci,2.1,3.1,3.3
13-09-25,15:00,FC Zimbru Chisinau vs FC Balti,Moldova Super Liga,26981,FC Zimbru Chisinau,FC Balti,1.24,5.4,9.0
13-09-25,17:00,FC Milsami vs Dacia Buiucani,Moldova Super Liga,29598,FC Milsami,Dacia Buiucani,1.5,4.2,5.2
13-09-25,10:00,Gia Dinh vs Phu Dong Ninh Binh,Vietnam Vietnam Cup,26148,Gia Dinh,Phu Dong Ninh Binh,30.0,9.0,1.05
13-09-25,10:00,Long An FC vs Binh Dinh FC,Vietnam Vietnam Cup,32077,Long An FC,Binh Dinh FC,3.0,3.1,2.25
13-09-25,12:00,Dong A Thanh Hoa vs Hoang Anh Gia Lai,Vietnam Vietnam Cup,41652,Dong A Thanh Hoa,Hoang Anh Gia Lai,1.72,3.4,4.5
13-09-25,13:30,FK Angusht Nazran vs FC Rubin Yalta,"Russia 2. Liga, Division B, Group 1",45749,FK Angusht Nazran,FC Rubin Yalta,2.55,2.65,2.8
13-09-25,14:00,FC Kuban Holding Pavlovskaya vs FC Astrakhan,"Russia 2. Liga, Division B, Group 1",27900,FC Kuban Holding Pavlovskaya,FC Astrakhan,1.68,3.2,4.6
13-09-25,14:00,FC Spartak Nalchik vs Dinamo Stavropol,"Russia 2. Liga, Division B, Group 1",45843,FC Spartak Nalchik,Dinamo Stavropol,10.5,5.1,1.19
13-09-25,16:00,FC Druzhba Maykop vs FC Nart Cherkessk,"Russia 2. Liga, Division B, Group 1",28230,FC Druzhba Maykop,FC Nart Cherkessk,2.5,2.75,2.7
13-09-25,16:00,FC Sevastopol vs Pobeda Khasavyurt,"Russia 2. Liga, Division B, Group 1",34788,FC Sevastopol,Pobeda Khasavyurt,2.15,2.8,3.2
13-09-25,17:00,FC Sochi II vs FC Dynamo-2 Makhachkala,"Russia 2. Liga, Division B, Group 1",37755,FC Sochi II,FC Dynamo-2 Makhachkala,1.12,5.75,16.0
13-09-25,12:00,FC Strogino Moscow vs Ska-Khabarovsk-2,"Russia 2. Liga, Division B, Group 3",28272,FC Strogino Moscow,Ska-Khabarovsk-2,2.0,3.1,3.6
13-09-25,14:00,FC Dynamo Bryansk vs Arsenal-2 Tula,"Russia 2. Liga, Division B, Group 3",26786,FC Dynamo Bryansk,Arsenal-2 Tula,1.64,3.3,5.4
13-09-25,14:00,FK Ryazan vs Zenit Penza,"Russia 2. Liga, Division B, Group 3",29125,FK Ryazan,Zenit Penza,1.89,2.95,4.3
13-09-25,15:00,FK Orel vs FC Metallurg Lipetsk,"Russia 2. Liga, Division B, Group 3",28383,FK Orel,FC Metallurg Lipetsk,3.1,2.9,2.3
